00:19:39.751,00:19:42.090,你到贵州的山区扶贫,00:19:39.485,00:19:41.960,"for example, in the “helping the poor” projects
in the mountains of Guizhou Province,"
00:19:42.091,00:19:43.680,他叫数目字管理,00:19:41.960,00:19:47.420,"we have ""digital management"" — the government can directly remit money to bank accounts of the poor families"
00:19:43.681,00:19:51.840,就你给这个农户贫困户与银行卡上面有卡号和手机还绑定,00:19:47.420,00:19:51.200,They have a bank card with an account number
00:19:51.841,00:19:54.840,所以政府可以把钱直接打到这个卡号上,00:19:51.505,00:19:54.355,and their account is linked with their mobile phones.
00:19:54.841,00:19:56.280,这个能力是不容易,00:19:54.520,00:19:56.080,This is not easy.
00:19:56.281,00:19:57.750,我走过很多非洲国家,,,
00:19:57.751,00:20:00.240,他的政府到现在都没有这个能力,00:19:56.080,00:19:59.480,"I have been to many African countries. Governments
there cannot do this even today."
00:20:00.241,00:20:03.540,他不可能把这个治理落实到最基层,00:19:59.895,00:20:03.055,They are unable to make the policy reach grassroots communities.
00:20:03.541,00:20:06.060,要非洲国家艾滋病非常厉害,00:20:03.185,00:20:05.935,"AIDS is a serious problem in African countries,"
00:20:06.061,00:20:09.300,但是政府想把这个要发到底层发不到的,00:20:05.940,00:20:09.160,"while the governments feel it’s hard to give away AIDS
medicine to the people."
00:20:09.301,00:20:13.050,我只是说就现代国家组织的涉及到一个底层结构的建筑,00:20:09.160,00:20:13.320,I am just commenting on the construction of the “lower structures” of a modern country.
00:20:14.190,00:20:14.550,那么,,,
00:20:14.551,00:20:18.690,王人还提出就是1978年开始的改革开放,00:20:13.920,00:20:18.200,Huang Renyu also proposes that the Reform-and-Open beginning in 1978
00:20:18.691,00:20:19.050,他说,,,
00:20:19.051,00:20:23.370,实际上是为中国重建遇到中层结构,00:20:18.520,00:20:22.500,"reshaped the “middle structure” of China,"
00:20:23.371,00:20:26.700,也就是我们叫做史和现代市场经济,00:20:23.400,00:20:25.335,"that is to say,"
00:20:26.701,00:20:27.570,现代社会,,,
00:20:27.571,00:20:31.680,现代国家相配套的司法监察,00:20:25.340,00:20:30.560,"the judiciary, governmental supervision, taxation,
logistics and other systems"
00:20:31.681,00:20:32.490,税收,,,
00:20:32.491,00:20:34.020,物流等等,00:20:30.560,00:20:36.100,"which match with and support a modern market
economy, modern society, and modern country."
00:20:34.021,00:20:39.630,这个系统支撑体系通过长达百年的不懈的努力,00:20:36.200,00:20:39.400,"Through efforts of a hundred years,"
00:20:39.631,00:20:43.770,我们应该所建立了一个由上中,00:20:39.400,00:20:48.000,"we have built a strong modern country
with three layers: top, middle, bottom."
00:20:43.771,00:20:48.390,下三层结构组成的一个强大的现代国家,,,
00:20:48.391,00:20:50.820,形成了空间统一的政府,00:20:48.080,00:20:51.180,"We have formed a modern country that has a unified government,"
00:20:51.690,00:20:52.710,统一的市场,00:20:51.380,00:20:52.600,"a unified market,"
00:20:52.711,00:20:53.640,统一的经济,,,
00:20:53.641,00:20:54.450,同名的教育,00:20:52.600,00:20:55.600,"unified economy, education, national defense,"
00:20:54.451,00:20:55.320,统一的国防,,,
00:20:55.321,00:20:56.160,统一的外角,,,
00:20:56.161,00:20:56.940,铜的金融,00:20:55.600,00:20:57.600,"unified diplomacy, finance,"
00:20:57.960,00:20:59.670,还货币税收等等,00:20:57.640,00:20:59.540,currency and taxation and so on.
00:20:59.671,00:21:01.860,这都是现代国家必备的,00:20:59.540,00:21:01.680,All are necessary to a modern country.
00:21:01.861,00:21:02.430,但是呢,,,
00:21:02.431,00:21:03.030,我想指出,,,
00:21:03.031,00:21:05.370,就是我们的国家又和其他国家不一样,00:21:01.680,00:21:06.120,"But our country is different, or quite different from other countries."
00:21:05.371,00:21:06.870,真的很不一样,,,
00:21:06.871,00:21:13.800,因为我们古老文明形成的许多传统并没有随着就是现代国家建立而消失,00:21:06.640,00:21:13.100,"Many of our old traditions haven’t disappeared with the
founding of a modern state."
00:21:13.801,00:21:14.760,恰恰相反,,,
00:21:14.761,00:21:15.840,还是被保留下来,00:21:13.640,00:21:16.340,"On the contrary, they remain,"
00:21:16.830,00:21:19.170,而且现代国家的载体中,00:21:16.480,00:21:21.400,and even further develop themselves in the modern country.
00:21:19.171,00:21:22.020,可能这些元素得到更好的发挥,,,
00:21:22.021,00:21:24.630,那么这就是我想跟大家再简单谈谈,00:21:21.695,00:21:25.700,That’s what I want to talk about the “civilizational state”.
00:21:24.631,00:21:26.730,叫文明型国家,,,
00:21:26.731,00:21:27.930,那么关于这个概念,,,
00:21:27.931,00:21:30.510,我想提三位学者,00:21:26.360,00:21:30.100,Three scholars can be related to this concept.
00:21:30.511,00:21:38.460,因为那是美国政治文化学者叫白鲁迅如仙怕他认为中国是不大可能建设成一个现代国家,00:21:30.500,00:21:34.800,"The first one is American scholar in political culture, Lucian Pye."
00:21:38.461,00:21:40.050,包括现在的法治,00:21:35.015,00:21:38.125,He believes that China is not very likely to be built as a modern state
00:21:40.051,00:21:41.190,现代的国防,00:21:38.125,00:21:42.000,"with the modern judiciary, national defense, or modern economy."
00:21:41.191,00:21:42.360,现代经济等等,,,
00:21:42.361,00:21:44.310,我们很多公司现在也这样的观点,00:21:42.060,00:21:44.900,Many of the public intellectuals in China hold the same opinion.
00:21:45.840,00:21:46.140,那么,,,
00:21:46.141,00:21:49.050,他把中国称之为文明国家,,,
00:21:49.051,00:21:51.390,英文叫C位来咨询,00:21:45.660,00:21:54.860,He calls China a “civilization-state”.
00:21:51.391,00:21:54.060,然后一个联系好黑粉,,,
00:21:54.061,00:21:55.650,是对这位来追寻时代,,,
00:21:56.790,00:22:00.150,那么他表示这两者两个名词是相同的概念,00:21:56.440,00:21:59.620,"He explains that the ""civilization"" and the ""state"" are the same."
00:22:00.151,00:22:05.220,让他讲过一句很有名的话就说是中国是一个是未来的一群朋友,00:21:59.825,00:22:09.300,"He has a famous comment: ""China is a
civilization pretending to be a state""."
00:22:05.221,00:22:09.270,肯定特别是对就是想装成现代国家的一个文明,,,
00:22:10.470,00:22:10.950,也就是说,,,
00:22:10.951,00:22:13.740,本站你是一个古老的文明,00:22:10.095,00:22:13.600,"He means that China is actually an ancient civilization,"
00:22:13.741,00:22:15.180,你不是一个现代国家,00:22:13.600,00:22:15.045,"not a modern state,"
00:22:15.181,00:22:15.840,但表面看,,,
00:22:15.841,00:22:17.370,你是一个国家,00:22:15.045,00:22:16.860,even though it seems to a country.
00:22:17.371,00:22:20.250,所以他这话里面是带有贬义的,00:22:17.020,00:22:19.700,This is a pejorative comment.
00:22:20.251,00:22:21.450,那么钓位学者,,,
00:22:21.451,00:22:24.570,那就是马丁雅克也是我的好朋友,00:22:20.280,00:22:23.020,"The second scholar is Martin Jacques, my friend,"
00:22:24.571,00:22:26.940,就会研究院的资深研究员,00:22:23.025,00:22:25.965,and a senior researcher at our China Institute.
00:22:26.941,00:22:30.720,那么他在09年时出版了一本颇有争议的书,00:22:26.645,00:22:31.500,"He published a controversial book in 2009,"
00:22:30.721,00:22:33.450,爱就是当中国统治世界,00:22:31.840,00:22:33.900,"""When China Rules the World."""
00:22:34.740,00:22:34.980,那么,,,
00:22:34.981,00:22:36.750,这个书名坦率说,,,
00:22:36.751,00:22:40.410,不太符合中国人的思维习惯,00:22:34.400,00:22:39.640,This name is alien to our Chinese thinking.
00:22:40.411,00:22:41.070,但是呢,,,
00:22:41.071,00:22:42.090,他本人也讲过,,,
00:22:42.091,00:22:43.350,他说是出版商,00:22:39.840,00:22:44.800,But the publisher insisted to use this name
00:22:43.351,00:22:48.750,坚持要用这个家才能卖号标题党标题党,00:22:44.800,00:22:47.800,— an attractive title would bring a better sale.
00:22:48.751,00:22:50.400,那么他和白鲁恂不一样,00:22:48.600,00:22:50.600,"Different from Lucian Pye,"
00:22:50.401,00:22:52.860,在什么他对文明国家的概念了,,,
00:22:52.861,00:22:57.030,做了比较中性的正面的阐述,00:22:50.600,00:22:56.360,"he elaborates rather neutrally and more positively on the concept “civilization-state”,"
00:22:57.031,00:23:00.090,随他得出一个非常明确的结论,00:22:56.700,00:22:59.760,and he reaches a clear conclusion:
00:23:00.091,00:23:03.570,就说是中国是不一样的国家,00:22:59.765,00:23:05.700,"China will not develop like Western countries,"
00:23:03.571,00:23:08.970,中国不会变成另外一个西方国家来中国的崛起会改变整个世界,00:23:06.255,00:23:09.065,and China’s rise will change the world.
00:23:10.260,00:23:12.150,所以他是做了这么一个结论,00:23:09.895,00:23:13.800,"Now, this conclusion seems reasonable."
00:23:12.151,00:23:13.740,现在看来是站得住脚,,,
00:23:15.000,00:23:15.960,但是呢,,,
00:23:15.961,00:23:17.220,马丁雅克也认为,00:23:14.655,00:23:17.425,But Martin Jacques also claims that
00:23:17.221,00:23:19.830,就是中国的这个民族,00:23:17.425,00:23:21.600,there can be certain kinds of conflicts between China’s two features:
,,,00:23:21.605,00:23:26.100,being a nation state and a traditional civilization.
00:23:19.831,00:23:35.580,国家和这个传统文明这两个特性之间可能有某种张力某种冲突不要说他认为中国可能在今后在东亚以某种形式复活自己利益上存在过的朝贡体系,00:23:26.785,00:23:30.900,"For example, he thinks that China may, in some ways,"
,,,00:23:30.900,00:23:35.400,revive the “tribute system” which existed in the history of East Asia.
00:23:36.930,00:23:37.380,他说,,,
00:23:37.381,00:23:41.520,他中国人探索实践还是有一种种族优越感,00:23:36.620,00:23:40.860,"He also claims that Chinese, in fact, feel superior about their ethnicity,"
00:23:41.521,00:23:42.120,他说,,,
00:23:42.121,00:23:45.750,可能也会对现有的国际秩序形成某种挑战,00:23:40.860,00:23:46.100,which may challenge the current international order.
00:23:46.800,00:23:49.470,那么第三个选择就是我自己,00:23:46.455,00:23:49.195,The third scholar is me.
00:23:49.471,00:23:52.350,那么我认为就是中国首先是一个现代过,00:23:49.195,00:23:52.235,"Firstly, I think China is a modern country."
00:23:53.460,00:23:59.130,额这是我对中国模式中国道路研究后得出的非常慎重的结论,00:23:53.455,00:23:56.575,This is a conclusion I cautiously make
00:24:00.480,00:24:01.290,那么,00:23:56.675,00:23:59.325,after I have studied China's mode and China's path.
00:24:01.291,00:24:06.840,但是中华文明的种种特质又使中国这个现代国家与众不同,00:24:00.125,00:24:06.200,"But traits of the Chinese civilization also make China a
modern country different from others."
00:24:06.841,00:24:09.900,所以他确实融合了这个古代文明,00:24:06.515,00:24:12.400,"Indeed, it has combined the advantages of the ancient
culture with those of the modern culture."
00:24:09.901,00:24:10.800,现代文明,,,
00:24:10.801,00:24:17.040,两者之间的长处就是我上次也简单提到过你无论走到哪里,00:24:12.575,00:24:15.085,And I have mentioned this last time:
,,,00:24:15.085,00:24:16.680,"wherever we live,"
00:24:17.041,00:24:19.860,中国是世界上最勤劳的名字,00:24:16.740,00:24:20.500,the Chinese nation is the most hard-working and the most active in the world.
00:24:19.861,00:24:21.840,最向上的米汤改变命运,00:24:20.500,00:24:22.540,We're determined to change our fate.
00:24:22.830,00:24:24.990,这个民族最平和,00:24:22.540,00:24:24.240,This is also the mildest nation.
00:24:24.991,00:24:27.930,就这些特质带来几年中国的崛起,00:24:24.660,00:24:27.320,All these features lead to China’s rise today.
00:24:27.931,00:24:33.090,那么中国也接受了现代国家一些基本的这个理念,00:24:27.625,00:24:33.000,"China has accepted some basic concepts of modern countries,"
00:24:33.091,00:24:36.120,向朱权平等向人群,00:24:33.000,00:24:35.640,"such as equality of sovereignty, human rights,"
00:24:36.121,00:24:38.400,所以中国不会恢复朝贡体系,00:24:35.800,00:24:37.900,"so China will not restore the tribute system,"
00:24:38.401,00:24:40.950,也不会拥抱种族优越论,00:24:38.220,00:24:41.140,or accept racial superiority.
00:24:42.120,00:24:45.030,所以我用的是文明型国家,00:24:41.775,00:24:47.400,That’s why I call it a “civilizational state”.
00:24:45.031,00:24:48.000,因为我的幡子随便来人一身都是的,,,
00:24:48.001,00:24:48.900,这个是个癞子,00:24:47.705,00:24:50.025,It is different from the “civilization-state”.
00:24:48.901,00:24:49.890,就是这次不一样,,,
00:24:51.090,00:24:51.420,此外,,,
00:24:51.421,00:24:54.450,事情是对是两个瓶的瓶瓶平起平坐,00:24:50.755,00:24:54.300,"""Civilization-state"" contains two concepts with equal weights,"
00:24:54.451,00:24:54.840,谁不来,,,
00:24:54.841,00:24:59.280,为什么是对自己未来人生的是个形容词文明型的修饰,00:24:54.300,00:25:00.200,"whereas in ""civilizational state"",
""civilizational"" describes the “modern state”."
00:24:59.281,00:25:00.300,这个现代国家,,,
00:25:01.590,00:25:02.220,那么,,,
00:25:02.221,00:25:07.200,所以是我这个文明型国家概念比白鲁迅的文明国家概念要积极得多,00:25:01.245,00:25:07.100,"So, the concept “civilizational state” is more positive
than Lucian Pye’s concept the “civilization-state”."
00:25:09.180,00:25:11.220,那么我一个基本的看法是,,,
00:25:11.221,00:25:15.660,我迷信国家具有超强的历史底蕴和文化底,00:25:08.825,00:25:14.800,"My basic idea is that a “civilizational state” inherits
abundant historical and cultural legacies,"
00:25:15.661,00:25:19.080,他不会跟着其他国家亦步亦趋,00:25:15.335,00:25:18.565,so it will not follow every step of other countries.
00:25:19.081,00:25:26.640,那么这种文明型国家有能力汲取其他文明的一切长处而不失去自我,00:25:18.725,00:25:26.000,"It is able to absorb the advantages of other civilizations
without losing its own identity."
00:25:26.641,00:25:31.560,而且能够对世界文明作出大量的原创性的贡献,00:25:26.280,00:25:31.000,It can make a large number of creative contributions to the global culture.
00:25:31.561,00:25:33.780,那么多次讲过这样的一个比喻,00:25:31.240,00:25:34.255,I have said this a lot:
00:25:33.781,00:25:37.380,我说就像汉语扩大自己的影响,00:25:34.255,00:25:39.900,"In order to expand the influence of the Chinese language, we need not cater for preferences of English."
00:25:37.381,00:25:39.330,不需要理会英语的偏好,00:25:40.085,00:25:43.345,"Just as Sun-Tzu's The Art of War doesn’t need approval from Clausewitz,"
00:25:40.440,00:25:46.320,就像孙子兵法不需要克劳塞维茨来人就像孔夫子不需要波拉出来认可,00:25:43.465,00:25:46.205,"or Confucius the approval of Plato,"
00:25:46.321,00:25:50.190,这样中国的宏观调控不需要美联储来认可,00:25:46.205,00:25:49.380,or China’s macro-economic regulation the approval of the Fed.
00:25:50.191,00:25:55.140,而更可能发生的事虽然已经在开始出现,00:25:49.760,00:25:54.400,It's more likely ... or have already happened
00:25:55.141,00:25:59.100,汉语可能会逐步的影响英语或者其他语言,00:25:54.600,00:25:58.640,that the Chinese language may gradually influence English or other languages.
00:25:59.101,00:26:04.530,那么孙子兵法当然已经是营销界既会影响西方的军事思想,00:25:58.800,00:26:03.680,"Sun-Tzu’s The Art of War has already changed, and will
continue to change, Western military doctrine."
00:26:04.531,00:26:09.030,孔夫子和柏拉图都为人类社会提供了宝贵的智慧,00:26:04.180,00:26:08.500,Confucius and Plato have all provided precious wisdom to this world.
00:26:09.031,00:26:10.800,那么中国的宏观调控,00:26:08.600,00:26:10.960,"As for China’s macro-economic regulation,"
00:26:10.801,00:26:14.250,我自认为美国可以借鉴不少,00:26:10.960,00:26:14.340,I do believe America can learn a lot from it
00:26:14.251,00:26:14.760,呵呵,,,
00:26:14.761,00:26:15.630,呵呵,00:26:14.340,00:26:15.280,(laughs)
00:26:15.631,00:26:16.920,但他有点困难啊,00:26:15.500,00:26:17.340,but to do so can be hard.
00:26:18.090,00:26:19.860,那么这样我们就可以回到我们,,,
00:26:19.861,00:26:23.160,在这个这个演讲开始时提出问题,00:26:17.760,00:26:22.800,"Then, we will come back to the question at the beginning of my speech."
00:26:23.161,00:26:26.280,就是西方为什么老是误读中国,00:26:22.865,00:26:25.815,Why does the West always misunderstand China?
,,,00:26:25.905,00:26:31.200,"Because the West always interprets China based on
their limited experience from their history"
00:26:26.281,00:26:27.180,因为西方了,,,
00:26:27.181,00:26:36.360,他总是基于自己的这个有限的历史经验和在这个经验计算形成话语来读中国,00:26:31.635,00:26:35.600,"and the discourses formed from these experiences,"
,,,00:26:36.000,00:26:37.660,"such as “west centrism”,"
00:26:36.361,00:26:42.120,比方说西方中心论欧洲中心论历史终结论都在这种范围下来,00:26:37.900,00:26:40.000,"“eurocentrism”, or “the end of the history”."
00:26:42.121,00:26:43.680,这个理解中国,00:26:40.000,00:26:43.300,These are the lenses through which they view China.
00:26:43.681,00:26:45.360,所以他们这个逻辑是这样的,00:26:43.335,00:26:46.075,"Their logic [of development] begins from totalitarianism,"
00:26:45.361,00:26:46.380,就是收一觉,,,
00:26:46.381,00:26:49.200,从极权主义到威权组啊,00:26:46.075,00:26:49.105,"to authoritarianism,"
,,,00:26:49.105,00:26:51.255,"then finally, ends at the Western democracy."
00:26:49.201,00:26:55.860,那再到西方民主制度这个概念下的这个历史发展是单线条的,00:26:51.655,00:26:55.700,"Under this logic, the development of history is linear,"
00:26:55.861,00:26:58.980,这种发展的西方的政治模式终结了,00:26:55.800,00:26:58.800,and it terminates at the Western political system.
00:26:58.981,00:27:03.090,所以这是我们现在看来非常荒谬的那个吴宓音国家,00:26:58.800,00:27:01.300,This is absurd in our eyes.
00:27:03.091,00:27:05.700,他崛起是一个完全不同的,00:27:01.585,00:27:06.600,The rise of a civilizational country follows a totally different logic.
00:27:07.440,00:27:14.490,首先历史上的我是长期领先西方只有领先尤其重要的原因,00:27:07.105,00:27:11.000,"In history, China was ahead of the West for a long time"
00:27:15.330,00:27:17.010,我把称谓原因一,00:27:11.775,00:27:17.100,"for an important reason — I will call it ""reason one""."
00:27:18.360,00:27:23.580,那么后来18世纪开始又落后了这个落后有深刻的教训,00:27:17.965,00:27:21.500,"Then, in the 18th century, China was left behind by the West,"
00:27:23.581,00:27:26.010,再通过过去数十年的努力,00:27:21.500,00:27:23.500,which taught us a profound lesson.
00:27:26.011,00:27:28.050,我们又真的是赶上来了,00:27:23.500,00:27:27.900,"After decades of efforts, we have finally caught up with the West,"
00:27:28.051,00:27:32.040,某些方面还超越了这个赶超的成功,00:27:27.900,00:27:30.040,and even surpassed it in some areas.
00:27:32.041,00:27:33.090,也有她的原因,00:27:30.040,00:27:34.500,"I call the reasons for this success ""reason two""."
00:27:33.091,00:27:34.110,我叫原因,,,
00:27:34.111,00:27:34.410,二,,,
00:27:35.490,00:27:41.640,这个原因二和园艺之间是有一种继承和发展的关系,00:27:35.200,00:27:40.240,"Historically speaking, reason two inherits and furthur develops reason one."
00:27:41.641,00:27:45.000,就故事立意上我为什么比你做的好,00:27:41.260,00:27:46.240,Why China was ahead of the West in history and why we could catch up or even surpass
00:27:45.001,00:27:49.740,我今天又赶上了甚至超越你是有历史的继承发展关系,00:27:46.240,00:27:49.400,is linked by historical inheritance and development.
00:27:49.741,00:27:54.810,比方我历史上我们是民本主义的传统民为邦本本,00:27:49.400,00:27:52.680,"For instance, in history, we have a people-centered tradition."
00:27:54.811,00:27:57.570,固邦宁就政府要做事情,00:27:52.780,00:27:56.240,"""People are the foundation of a country; peace is guaranteed when this foundation is solid.” [Book of Documents by Confucius]"
00:27:57.571,00:27:59.760,首先就是关注民生,00:27:56.240,00:28:03.000,"The priority of the government is people, and improving
people’s living materially and spiritually."
00:27:59.761,00:28:01.290,改善民生,,,
00:28:01.291,00:28:04.170,包括物质生活精神生活方面,,,
00:28:04.171,00:28:06.600,所以西方今天这个模式最大的问题,00:28:03.785,00:28:06.605,"However, the biggest problem of the Western model today,"
,,,00:28:06.605,00:28:09.085,"no matter in Western or non-Western countries,"
00:28:06.601,00:28:13.620,无论在西方本身还在非西方国家政治机器空转不落实到改善民生,00:28:09.085,00:28:11.540,"is the “idle spinning"" of the political machine."
,,,00:28:11.540,00:28:13.480,The government can't effectively improve people’s living.
00:28:13.621,00:28:17.250,所以西方模式在飞信上写的西方姐都开始走下坡了,00:28:13.480,00:28:17.100,"As a result, the Western system is facing a decline in
both the Western and non-Western world."
00:28:18.660,00:28:20.760,背后上是两种哲学观,00:28:18.240,00:28:20.740,Behind this are two philosophical outlooks.
00:28:20.761,00:28:24.600,一种西方中心论的这个历史单线发展的哲学观,00:28:20.740,00:28:24.500,"One is about West-centrism, a linear outlook of philosophy."
00:28:25.740,00:28:28.380,那么我代表最好的制度啊,00:28:25.340,00:28:28.560,"In this view, people believe they have the best system,"
00:28:28.381,00:28:31.260,然后你就发展到我这个制度,00:28:28.560,00:28:33.500,and others should work hard to reach the same system.
00:28:31.261,00:28:33.750,最后你就变得很好,,,
00:28:33.751,00:28:35.280,那么中国不是这样的中国人,,,
00:28:35.281,00:28:36.000,这个历史观,,,
00:28:36.001,00:28:38.970,他是一上各种模式都存在,00:28:33.600,00:28:38.400,"On the contrary, in the Chinese conception of history,
all kinds of systems have coexisted,"
00:28:38.971,00:28:40.440,从来就是百花齐放的,00:28:38.620,00:28:42.200,and sometimes even been in conflict with each other.
00:28:40.441,00:28:41.940,甚至有时候互相打架,,,
00:28:42.930,00:28:45.960,但即使你这模式过去很好,00:28:42.540,00:28:45.380,"A system might have worked well,"
00:28:45.961,00:28:49.170,但是我们讲的这个骄傲使人落后,00:28:45.580,00:28:49.240,"however, we say ""prideful people will forget to make further progress"","
00:28:49.171,00:28:51.030,如果你真的羊羊得意自满了,,,
00:28:51.031,00:28:53.400,最有可能落后被人家赶上,00:28:49.240,00:28:53.100,and they can be easily surpassed by others.
00:28:53.401,00:28:57.960,所以他这个历史竞争是复合式的多线条的动态,00:28:53.300,00:28:58.260,"The competition in Chinese
history is multiple-tracked and dynamic."
00:28:59.130,00:29:00.840,那么下周啊,,,
00:29:00.841,00:29:03.210,我还想谈就是文明型国家的,00:28:58.760,00:29:05.220,"Next week I’m going to talk about
the ""four supers” of our civilizational state:"
00:29:03.211,00:29:11.010,这个我叫四超超大型的人口规模超广阔的疆域国土超悠久的历史传统,00:29:05.820,00:29:13.280,"super large population scale, super vast territory,
super long history and super rich cultural accumulation."
00:29:11.011,00:29:12.600,超丰富的文化积淀,,,
00:29:12.601,00:29:16.890,我觉得这个是文明国家崛起的最精彩的地方,00:29:13.300,00:29:18.800,This is the most amazing part in the rise of China and will astonish the world.
00:29:16.891,00:29:17.340,然后呢,,,
00:29:17.341,00:29:18.900,会震撼整个世界,,,
00:29:18.901,00:29:20.220,今天我就说几句好吧,00:29:19.020,00:29:21.060,That’s all for today’s speech. Thank you!
00:29:20.221,00:29:20.640,谢谢大家,,,
00:29:24.360,00:29:26.010,掌声是送给张强说的,00:29:23.760,00:29:26.080,The applause is for Professor Zhang.
00:29:26.011,00:29:27.600,您辛苦了请客,00:29:26.260,00:29:28.320,Thank you for your speech. Please take a seat.
00:29:27.601,00:29:29.100,不过我是学语言出身的吧,,,
00:29:29.101,00:29:30.660,所以对刚才张总提到有一点,00:29:28.340,00:29:30.420,I majored in language studies
00:29:30.661,00:29:31.500,我感触很深,,,
00:29:31.501,00:29:35.340,就是说这个文字的这个传承下来的力量,00:29:30.420,00:29:35.160,"and I'm impressed with one thing in Professor’s speech
— the power inherited with the language we passed on."
00:29:35.341,00:29:41.640,我曾经看过这个一些民国时期的当时有一定有一个思潮说要去汉字化,00:29:35.160,00:29:40.840,There was a scholarly trend to abandon Chinese characters during the Republic of China.
00:29:41.641,00:29:42.780,经过了一些探索,,,
