00:29:42.781,00:29:43.920,摸索失败尝试,00:29:41.620,00:29:45.960,"It was found impracticable after a series of exploration, trials and failures."
00:29:43.921,00:29:45.480,最后发现这个走不通,,,
00:29:45.481,00:29:46.500,走不下去,,,
00:29:46.501,00:29:47.400,这个就像您说的,,,
00:29:47.401,00:29:50.700,他跟这个民族的这个根基是有冲突的,00:29:46.520,00:29:50.560,"Just like you said, it would conflict with our national basis."
00:29:50.701,00:29:54.270,为什么明显同音字同音字那么多,00:29:50.560,00:29:54.780,"Why? Obviously, it is due to a large number of homophones."
00:29:54.271,00:29:56.400,这个所以文明型国家的这个传承,00:29:54.940,00:29:58.340,"To carry on the traditions of a civilizational state,"
00:29:56.401,00:30:01.500,他要一定要跟这个本国民族的这个习惯特点要紧密结合,00:29:58.340,00:30:01.960,things must be done according to native customs and features.
00:30:01.501,00:30:02.580,所以我就赶出这点,00:30:01.960,00:30:03.520,I totally agree with that.
00:30:02.581,00:30:05.520,特别是我们有时候一项国际接轨的国际化,00:30:03.780,00:30:06.740,"In some cases, we might lose our own features in internationalization."
00:30:05.521,00:30:06.780,就把自己给忘了,,,
00:30:06.781,00:30:09.420,所以千万不要忘记把自己给丢了哈,00:30:07.020,00:30:09.720,So never forget your own identities.
00:30:09.421,00:30:11.820,这个账号是这个演讲里面有一点,,,
00:30:11.821,00:30:15.300,我有这个深感的都有可能大家都是这个上学,00:30:10.540,00:30:13.860,I deeply resonated with one point in Professor Zhang's speech.
00:30:15.301,00:30:17.550,小时候我们看那个教科书什么一说,00:30:13.920,00:30:16.752,"When we were elementary students, we read from the textbook that"
00:30:17.551,00:30:19.170,中华民族是个勤奋的民族,00:30:16.752,00:30:18.920,the Chinese people were hardworking and diligent.
00:30:19.171,00:30:20.400,待会觉得很空洞,,,
00:30:20.401,00:30:22.140,就是哪个民族不勤奋,00:30:18.920,00:30:22.820,We felt it was hollow because all nations are hardworking.
00:30:22.141,00:30:23.400,不勤奋都很勤奋,,,
00:30:23.401,00:30:24.240,不是这样子的,00:30:22.820,00:30:24.080,But it's not so.
00:30:24.241,00:30:25.860,现在发现中华民族是真爱,00:30:24.085,00:30:26.905,Now we realize Chinese people are truly hardworking.
00:30:25.861,00:30:26.970,真勤奋,,,
00:30:26.971,00:30:28.050,这个不是开玩笑,00:30:26.905,00:30:28.120,It isn't joking.
00:30:28.051,00:30:30.930,包括到一些欧洲国家同时去旅游,00:30:28.120,00:30:31.000,Some of my colleagues traveled to Europe.
00:30:30.931,00:30:32.250,大家可能去看一下,,,
00:30:32.251,00:30:35.640,到那时你会发现别人下午早早可能四点就下班了,00:30:31.000,00:30:35.240,They found people get off work early in the afternoon at about four o'clock.
00:30:35.641,00:30:37.440,然后要杯咖啡望着大海,00:30:35.660,00:30:38.400,"They would order a cup of coffee, sit on the beach.
A whole afternoon would pass."
00:30:37.441,00:30:38.460,一下午就过去了,,,
00:30:38.461,00:30:39.030,一句话也不说,,,
00:30:39.031,00:30:41.190,黑杯咖啡看大海,00:30:38.620,00:30:42.080,"They would spend the afternoon like this, drinking coffee to the sea."
00:30:41.191,00:30:42.570,我一下午就过去了,,,
00:30:42.571,00:30:44.970,这个时候你才意识到这个小时候学的啊,,,
00:30:44.971,00:30:46.680,蒋中华民族是个勤奋的民族,00:30:42.580,00:30:47.560,Not until that time did they realize the appraisal of our diligence was pertinent.
00:30:46.681,00:30:49.200,这样不是空的是真的,00:30:47.560,00:30:49.120,It's the truth.
00:30:49.201,00:30:52.170,我们可能对自己的勤奋都已经习以为常,00:30:49.120,00:30:52.320,Probably we have been too used to our diligence
00:30:52.171,00:30:55.470,碳就像我们对自己的古老文明也习以为常,00:30:52.640,00:30:55.600,just as we have taken our ancient civilization for granted.
00:30:55.471,00:30:55.920,太一样,,,
00:30:55.921,00:30:57.660,我们都忘了去研究他,00:30:55.800,00:30:57.920,We even forgot to study it.
00:30:57.661,00:30:58.320,那接下来呢,,,
00:30:58.321,00:31:00.090,我们就要开放现场提问者啊,00:30:57.920,00:31:02.080,Now it's time for Q&As.
00:31:00.091,00:31:04.620,哈我们来举手示意我任何想问问题的朋友都可以举手,00:31:02.180,00:31:04.660,Put up your hands if you have any questions.
00:31:04.621,00:31:05.880,您抢到了话筒吧,,,
00:31:05.881,00:31:06.510,那传过来,00:31:05.220,00:31:07.200,Please pass the microphone to him.
00:31:06.511,00:31:08.610,张教授我也经常看你的节目,00:31:07.200,00:31:09.929,"Professor Zhang, I’ve seen many of your shows."
00:31:08.611,00:31:09.660,我是这么想的,,,
00:31:09.661,00:31:13.230,就是我们平时要讲究实事求是,00:31:09.929,00:31:12.940,"We say ""seek truth from facts""."
00:31:13.231,00:31:15.240,就是任何的理论观点,00:31:13.160,00:31:16.980,Any theory or viewpoint has to go through a developing period.
00:31:15.241,00:31:17.130,什么的都是要有发展的阶段,00:31:17.120,00:31:19.120,"In the case of Taiwan,"
00:31:17.131,00:31:23.310,比如说对台的那个问题能不能就是说重新去定位一下我们的一国两制政策,00:31:19.120,00:31:23.000,"I’m wondering whether we can redefine the
policy “one country, two systems”."
00:31:23.311,00:31:28.800,而且我个人认为九二共识简直就是像像我们提款的一个提款机密码了,00:31:23.260,00:31:28.100,"Personally, I’m doubting if they are using
“the 1992 Consensus” as an ATM password."
00:31:28.801,00:31:31.620,然后他们拿了我们的优惠政策,00:31:28.200,00:31:31.260,"Once they get the preferential policies from the mainland,"
00:31:31.621,00:31:33.840,有可能他们就去买武器装备,00:31:31.360,00:31:33.620,they are likely to purchase weapons [with the money].
00:31:33.841,00:31:34.950,然后说实在的,,,
00:31:34.951,00:31:36.210,如果真的要开战的话,00:31:33.780,00:31:36.880,"To be honest, if a war broke out across the Strait,"
00:31:36.211,00:31:40.080,那射向解放军的子弹有一半就是我们提供给他们的,00:31:36.960,00:31:39.680,half of the bullets fired at the PLA would be those provided by ourselves.
00:31:40.081,00:31:41.340,我们有些人就提出,00:31:39.760,00:31:42.280,Some people advise helping the KMT.
00:31:41.341,00:31:42.480,我们要帮助国民党,,,
00:31:42.481,00:31:45.090,但是我说你们提出帮助国民党,,,
00:31:45.091,00:31:46.680,那有没有想到27年的时候,00:31:42.440,00:31:48.920,"But have they ever considered how the KMT treated the Communist Party in the ""April 12 Massacre""?"
00:31:46.681,00:31:50.160,412国民党是怎么对待我们共产党的对吧,,,
00:31:50.161,00:31:54.240,所以我个人就是认为能不能就是说,00:31:49.400,00:31:56.220,"So, I’m wondering if we can re-evaluate the concept of “one country, two systems”"
00:31:54.241,00:31:58.500,我们重新思考一下一国两制的问题就是与时俱进,00:31:56.220,00:31:58.540,and keep it up with the times.
00:31:58.501,00:31:59.550,好好请教一下,,,
00:31:59.551,00:32:02.760,你是从事什么研究工作额,00:31:58.540,00:32:02.420,Would you mind telling us what area you work or research in?
00:32:02.761,00:32:04.440,我是通信工作的,00:32:02.420,00:32:04.500,I work in telecommunication.
00:32:04.441,00:32:05.940,不过我平时是军迷,,,
00:32:05.941,00:32:08.220,特别喜欢看那些军事报道,00:32:04.500,00:32:07.800,But I am a military fan and fond of military reports.
00:32:08.221,00:32:10.020,那么额我老说,00:32:08.260,00:32:10.580,I often say
00:32:10.021,00:32:12.420,就是有些东西就是中国,,,
00:32:12.421,00:32:18.150,这个词的特点是我们有一个长期的战略的思考,00:32:10.780,00:32:16.880,one feature of China’s system is that we have a long-term strategy.
00:32:18.151,00:32:21.450,实际上你给台湾的一些好处,00:32:17.900,00:32:23.500,"We don't ""haggle over every ounce"" with Taiwan
over the benefits given to it."
00:32:21.451,00:32:24.450,我们不是这样来斤斤计较的爱,,,
00:32:24.451,00:32:28.380,而在本质上是台独已经成为不可能的事情,00:32:24.060,00:32:28.280,Taiwan’s independence has essentially become impossible.
00:32:29.550,00:32:33.990,你今天大陆跟经济上跟台湾的这个联系,00:32:29.520,00:32:36.551,Their economic connection and reliance on the mainland mean that
00:32:33.991,00:32:36.810,以台湾对大陆经济上的依赖,,,
00:32:36.811,00:32:39.900,这意味着只要你正式的搞台独的话,00:32:36.551,00:32:40.835,seeking independence is suicide.
00:32:39.901,00:32:41.220,这就自杀,,,
00:32:41.221,00:32:45.090,我就不是初中人民解放军不出动的就是本身,00:32:40.840,00:32:43.920,"There’s no need to send PLA,"
00:32:45.091,00:32:47.910,你的股市将崩溃方式将崩溃,00:32:44.140,00:32:48.440,because they would have collapsing stock and housing markets.
00:32:47.911,00:32:49.500,经济将崩溃啊,,,
00:32:49.501,00:32:50.760,所以这一点就很了不起,,,
00:32:50.761,00:32:53.760,为什么中国现在很有定力对不对,00:32:49.380,00:32:54.220,"This is the most important reason
why China can keep a strategic focus."
00:32:53.761,00:32:55.650,这是最重要的爱,,,
00:32:55.651,00:32:57.840,那么至于因为你是军迷啊,00:32:55.620,00:32:58.140,"Military fan as you are,"
00:32:57.841,00:33:00.540,你可能技术角度考虑比较多,00:32:58.140,00:33:02.900,"you may consider more about the techniques
like how the bullets shoot to the PLA."
00:33:00.541,00:33:01.260,这个这个词,,,
00:33:01.261,00:33:03.480,但是像解放军啊,,,
00:33:03.481,00:33:06.930,到时候战争不会是这样打的,00:33:03.080,00:33:06.160,But the war wouldn’t go in that way.
,,,00:33:06.400,00:33:09.120,I want to add one more thing that
00:33:06.931,00:33:12.870,我又补充一点这个现代我们试以一个中国为前提的九二共识,00:33:09.120,00:33:12.460,“The 1992 Consensus” is based on “One China”.
00:33:12.871,00:33:15.510,但这个整个表述是会有细节上的不一样的,00:33:12.460,00:33:15.360,Some details may be expressed differently [by both sides].
00:33:15.511,00:33:17.310,但要我们提一国两治,,,
00:33:17.311,00:33:19.230,以前是一个一个一个方案,00:33:15.580,00:33:19.980,"And “one country, two systems” was a concept, a plan,"
00:33:19.231,00:33:24.570,这个想法现在我们希望要讨论一国两制的台湾方案,00:33:20.140,00:33:24.380,"but now we are discussing “the Taiwan solution for one country, two systems”."
00:33:24.571,00:33:29.700,而且现在岛内尽管可能从他们的报道上来说响应的人数不多,00:33:24.640,00:33:29.020,"Although according to their internal reports,
not so many people support this,"
00:33:29.701,00:33:31.560,但是是有响应的,00:33:29.140,00:33:31.880,there are still people who support this.
00:33:31.561,00:33:33.090,还有一个纠正你一个概念,00:33:31.880,00:33:34.300,"I also hope to rectify your view that
""We need to help the KMT""."
00:33:33.091,00:33:34.650,是我们要帮国民党,,,
00:33:34.651,00:33:36.060,你没有好好读这个系统,00:33:34.305,00:33:37.500,I guess you haven't fully understood documents from President Xi.
00:33:36.061,00:33:37.260,收集了很多的这个文件,,,
00:33:37.261,00:33:40.020,就是我们寄希望于台湾人民,,,
00:33:40.021,00:33:42.120,台湾各个团体,00:33:37.880,00:33:43.820,We have faith in the representatives of Taiwan people and social groups
00:33:42.990,00:33:45.390,人民的代表我们既不希望,,,
00:33:45.391,00:33:47.100,这既不寄托于国民党,00:33:44.220,00:33:49.320,"rather than the KMT, the DPP or any other parties."
00:33:47.101,00:33:49.590,也不寄托于迷倒任何政党,,,
00:33:49.591,00:33:52.890,但是任何支持统一谋求统一,00:33:49.320,00:33:54.040,But anyone supporting reunification and seeking peaceful development across the trait
00:33:52.891,00:33:56.430,谋求两岸和平发展的这才是我们要追求的对象,00:33:54.220,00:33:57.475,are the people we are going to win support from.
00:33:56.431,00:33:59.970,所以我们现在我不是对自己的同胞好啊,00:33:57.480,00:33:59.800,So we’re giving benefits to our compatriots.
00:33:59.971,00:34:03.660,我觉得真是干笑着说淡定淡定淡定好,00:33:59.800,00:34:02.840,"As Prof. Zhang said, we need to stay calm."
00:34:03.661,00:34:06.630,我们接下来再来看哪位朋友要举手啊,00:34:03.120,00:34:06.000,"OK, let's see if anyone else has a question."
00:34:06.631,00:34:10.470,这位就是我这个问题就是很明确,00:34:07.460,00:34:08.660,"Go ahead, please."
,,,00:34:08.780,00:34:11.240,I have a specific question.
00:34:10.471,00:34:18.030,就是前段时间在宪法修正案中那个提到的关于国家最高领导人这个任期限制的修改,00:34:11.240,00:34:17.600,"A while ago, the ""Constitution Amendment"" made changes to the term limit of the country's top leader."
00:34:18.031,00:34:21.870,然后这个图案其实出来之后周围的很多同学还有朋友,,,
00:34:21.871,00:34:23.760,有很多广泛的讨论,00:34:18.140,00:34:26.940,The amendment stimulated extensive discussion among my friends and some of their views are very sharp.
00:34:23.761,00:34:27.930,而且不乏其中有不少那些很尖锐的一些,,,
00:34:27.931,00:34:31.620,但是但是大家这些言论的可能都比较片面,00:34:28.200,00:34:31.180,"Our opinions may be partial,"
00:34:31.621,00:34:37.230,我在想你有没有更更全面性的站的角度不一样,00:34:31.225,00:34:36.620,"I hope to hear a more comprehensive understanding from you, from a different perspective."
00:34:37.231,00:34:41.880,不可能有一些是中国共产党的章程里是明确规定的,00:34:37.160,00:34:43.200,The Constitution of the CCP clearly stipulates the abolition of lifelong terms.
00:34:41.881,00:34:48.390,废除终身制对不对我们是交国家主席还是中国共产党员的话,00:34:44.240,00:34:48.100,"As long as the President is a member of the Communist Party of China,"
00:34:48.391,00:34:50.310,他就不能有重孙子,00:34:48.620,00:34:51.960,he cannot be in office for the length of his life.
00:34:51.630,00:34:52.380,去年四月,,,
00:34:53.520,00:34:59.670,我在美国的耶鲁大学这个谈中国崛起中国模式,00:34:53.160,00:34:59.060,"Last April, I gave a lecture on China’s rise and the China Mode at Yale University"
00:34:59.671,00:35:01.500,然后也是一个学者,00:34:59.295,00:35:02.725,a scholar raised the same question.
00:35:01.501,00:35:02.730,问你同样的问题,,,
00:35:03.960,00:35:04.110,哎,,,
00:35:04.111,00:35:08.370,我说你们美国的罗斯福总统是私人啊,00:35:03.580,00:35:08.940,"I answered former President Roosevelt served for four terms in the United States,"
00:35:08.371,00:35:14.400,对不对这个德国的阿登纳总理也是私人啊,00:35:09.480,00:35:16.760,as well as former Chancellor Adenauer and current Chancellor Merkel in Germany.
00:35:14.401,00:35:16.380,这个默克尔也是私人啊,,,
00:35:16.381,00:35:17.430,对不对,,,
00:35:17.431,00:35:18.270,而且罗斯福,,,
00:35:18.271,00:35:23.730,阿德那是公认的背着粮国家认为是极其出色的领袖人物,00:35:17.000,00:35:24.280,Roosevelt and Adenauer are recognized as outstanding leaders in these two countries.
00:35:25.230,00:35:25.710,让我说,,,
00:35:25.711,00:35:27.750,你们没有说他们是终身制,00:35:24.660,00:35:27.760,But you didn’t regard that as lifelong-term.
00:35:29.460,00:35:29.820,所以,,,
00:35:29.821,00:35:32.880,你们这些领导你担任了四任,00:35:29.080,00:35:35.180,Those leaders served four terms without the constitution declaring the abolition of a lifelong system.
00:35:32.881,00:35:34.410,而且你们没有任何章程,,,
00:35:34.411,00:35:35.730,你说废除终身制,,,
00:35:35.731,00:35:37.320,你们反而不质疑,00:35:35.580,00:35:38.620,But you’re not suspicious of them.
00:35:37.321,00:35:39.300,所以这是一个最关键的问题,00:35:38.620,00:35:40.180,That’s a contradiction.
00:35:40.410,00:35:44.070,那么我真是觉得就是政治制度的设计,,,
00:35:44.071,00:35:49.320,就是我叫做既要有下下策,00:35:40.520,00:35:50.020,I believe the design of a political system must include strategies for best and worst situations.
00:35:49.321,00:35:52.410,要有上上次下下策是保底的,,,
00:35:53.460,00:35:55.350,这包括这个领导人的这个,00:35:51.020,00:35:59.120,The worst situations may be the leader’s retirement for health reasons or limited ability.
00:35:55.351,00:35:55.890,不要说,,,
00:35:55.891,00:35:56.910,由于健康,,,
00:35:56.911,00:35:57.720,身体原因,,,
00:35:57.721,00:35:59.970,退休或者能力原因,,,
00:35:59.971,00:36:01.980,我们现在还有集体领导制度,00:35:59.680,00:36:03.000,We still preserve the system of collective leadership — democratic centralism.
00:36:01.981,00:36:03.900,民主集中制,,,
00:36:03.901,00:36:08.550,同时还有上上次上次就是在我这个制度里边,00:36:03.560,00:36:06.280,"Meanwhile, in the best situation,"
00:36:08.551,00:36:12.780,我能够让优秀的人才做好事,00:36:06.560,00:36:13.460,our system needs to allow outstanding talents to achieve high.
00:36:12.781,00:36:14.520,做大事,,,
00:36:14.521,00:36:16.440,这张老师的回答,00:36:14.200,00:36:16.475,"Thank you, Prof. Zhang."
00:36:16.441,00:36:17.730,我那个针对这个问题,00:36:16.480,00:36:18.980,"With respect to this question, I have a follow-up."
00:36:17.731,00:36:18.450,还有一个追问,,,
00:36:18.451,00:36:21.420,今年也是那个改革开放的40年的节点,00:36:18.980,00:36:23.140,"We've passed the 40the anniversary of reform and opening up, and we have entered the 41st year."
00:36:21.421,00:36:22.980,已经过了41年,,,
00:36:22.981,00:36:24.300,在这个改革的道路上,,,
00:36:24.301,00:36:26.730,就哪些能改哪些就不能改,00:36:23.140,00:36:26.540,"On the road to reform, what can we change and what should we hold up to?"
00:36:26.731,00:36:29.460,有没有就一些明确的界限,00:36:26.540,00:36:29.265,Is there a clear boundary?
00:36:29.461,00:36:31.410,正好你提子是休闲的问题,00:36:29.265,00:36:32.060,"Since you asked about the constitutional amendment,"
00:36:31.411,00:36:37.620,时尚休闲里面最关键是那句话就在宪法的第一条明确,00:36:32.260,00:36:36.640,The key point lies in the first Article in the constitution
00:36:37.621,00:36:42.540,中国共产党的领导是中国特色社会主义的最根本,00:36:36.640,00:36:43.680,which defines the leadership of the CCP as the essence of socialism with Chinese characteristics.
00:36:42.541,00:36:44.310,最本质特征是吧,,,
00:36:44.311,00:36:46.200,我自己也为研究,00:36:43.680,00:36:45.860,I’ve also studied that
00:36:46.201,00:36:50.160,就是中国共产党跟西方政党都较大,00:36:45.860,00:36:50.000,"the CCP and the Western political parties are both named as parties,"
00:36:50.161,00:36:51.570,但实际上不是一回事,00:36:50.000,00:36:52.800,but they are not the same.
00:36:52.860,00:36:55.950,那么政党这个词英文叫趴体,,,
00:36:55.951,00:36:56.880,欧子源都是这样,,,
00:36:56.881,00:36:58.020,过着反问着吧,00:36:52.800,00:37:02.560,"The English word “party” and “parti” in French
share the same language origin “part”,"
00:36:58.021,00:36:59.310,帝都都吃过了,,,
00:37:00.360,00:37:01.950,就是他对待这时候,,,
00:37:01.951,00:37:03.540,英文知道是不分的意思,,,
00:37:03.541,00:37:04.980,怕他过来,00:37:03.020,00:37:04.640,which means a section.
00:37:04.981,00:37:08.310,所以西方政党概念说简单是很简单,00:37:04.640,00:37:07.720,"Therefore, the concept of Western political parties can be explained very simply,"
00:37:08.311,00:37:11.460,就是社会不同的利益团体组成,00:37:07.880,00:37:11.180,"that is, society is composed of different interest groups."
00:37:11.461,00:37:12.210,然后没活力,,,
00:37:12.211,00:37:14.790,团结四季代表代表部分人,00:37:11.440,00:37:15.480,Each group represents the interests of some people and these groups compete.
00:37:14.791,00:37:15.900,然后出来竞争,,,
00:37:15.901,00:37:18.540,以50%U版的是由你我输入法,00:37:15.640,00:37:18.040,You win even if it's 51% against 49%.
00:37:18.541,00:37:20.190,就这样的逻辑,00:37:18.040,00:37:19.640,Such is their logic.
00:37:20.191,00:37:21.150,那么中国不一样,00:37:20.080,00:37:21.580,But things are different in China.
00:37:21.151,00:37:22.770,我觉得中国是文明型国家,00:37:21.580,00:37:23.560,Why is China regarded as a civilizational state?
00:37:22.771,00:37:29.430,为什么我面前国家最大特点是它是成百上千个国家慢慢整合起来,00:37:23.720,00:37:28.180,Its most important feature is that it is integrated from hundreds of small states over time.
00:37:29.431,00:37:30.180,这样的国家,,,
00:37:30.181,00:37:33.900,如果你采用西方的我叫部分利益党的制度的话,00:37:28.440,00:37:33.700,"If such a country adopts the party system with partial interests like Western countries,"
00:37:33.901,00:37:36.180,那国家是马上就解体了,00:37:33.700,00:37:35.620,it would soon disintegrate.
,,,00:37:35.740,00:37:38.160,"Maybe there would be a Shanghai Party, Beijing Party,"
00:37:36.181,00:37:40.800,明天就会有上海党北京到天津到无锡到济南倒,00:37:38.160,00:37:40.360,"Tianjin Party, Wuxi Party, Jinan Party,"
00:37:40.801,00:37:41.730,然后就打仗,00:37:40.365,00:37:41.980,and then wars would break out.
00:37:41.731,00:37:42.960,所以坦率的说,,,
00:37:42.961,00:37:44.880,从秦始皇统一中国以后,00:37:42.200,00:37:45.340,"Therefore, frankly speaking, ever since Qin Shi Huang unified China,"
00:37:44.881,00:37:49.470,开始绝大多数的时间内中国都是实心的,00:37:45.640,00:37:52.740,we've only had a unified ruling group most of the time.
00:37:49.471,00:37:53.160,我叫做某种形式的统一执政集团,,,
00:37:53.161,00:37:55.800,多数时间统一的儒家执政集团,00:37:52.760,00:37:55.000,And the ruling groups were mainly Confucian groups.
,,,00:37:55.360,00:37:57.400,"As I often tell Americans,"
00:37:55.801,00:37:59.520,你说我跟每个人说多数时间都是一档次,00:37:57.440,00:38:00.480,China has mostly been under the leadership of a single party
00:37:59.521,00:38:04.230,但这个多长时间内我们是远远领先西方不是一般的领先,00:38:00.480,00:38:03.420,but we were far ahead of the West most of the time.
00:38:04.231,00:38:05.460,而且在这个内部,,,
00:38:05.461,00:38:12.630,他的这个政策的调整幅度之大远远超过民主党共和党,00:38:03.780,00:38:10.620,"And the magnitude of adjustment in internal policies is far greater than in America,"
00:38:12.631,00:38:15.990,美国这种政治体制下的行政甚至调节,00:38:10.620,00:38:15.580,where the adjustments of policies are between Republicans and Democrats.
00:38:15.991,00:38:22.410,我们从文革到改革开放这个政策调整全在中国共产党内实现对不对,00:38:15.900,00:38:21.700,"By contrast, our policy adjustments from the Cultural Revolution to Reform and Opening-up were all made within the CCP."
00:38:22.411,00:38:27.090,这个远远超过美国共和党民主这个民主党之间的这个政策的差别,00:38:22.020,00:38:26.820,These changes are far greater than the changes between the Republican Party and the Democratic Party.
00:38:27.091,00:38:29.730,但我们还可以做到这一点,00:38:27.360,00:38:29.160,But we were able to achieve that.
00:38:29.731,00:38:30.840,所以我是明确的,,,
00:38:30.841,00:38:32.640,说句西方世不分离,00:38:29.720,00:38:34.680,"I would say, the Western parties are partial-interest groups while China has a representtive of its collective interest."
00:38:33.540,00:38:36.000,中国是整体利益导致最大的差,00:38:34.960,00:38:36.500,That’s the biggest difference.
00:38:36.001,00:38:40.200,而且你可以反过来用这个来看西方你碰到老外就问他,00:38:36.500,00:38:38.980,And you can view the West from this perspective.
00:38:40.201,00:38:45.150,你们国家有没有代表整体利益的政党呵呵,00:38:39.060,00:38:42.980,"You can ask foreigners, is there any party in your country representing the collective interest?"
00:38:45.151,00:38:50.250,结果差异这必杀技就是我们到了今天这个地步,00:38:44.100,00:38:46.860,"- Few.
- This is our unique skill."
00:38:50.251,00:38:51.750,觉得今天这个阶段,00:38:47.360,00:38:51.620,We've gone all the way to this day.
00:38:52.830,00:38:54.780,要建立制度认同,00:38:52.420,00:38:56.020,Institutional acceptance must be established.
00:38:54.781,00:38:57.960,不能再真的云里雾里的这叫制度自信,00:38:56.020,00:38:58.820,This is our confidence about our system.
00:38:57.961,00:39:01.050,爱爱过你爱着中华人民共和国自己,00:38:58.860,00:39:00.640,"We love our country,"
00:39:01.051,00:39:04.620,包括基于中华民国宪法的整个的制度安排,00:39:00.640,00:39:04.460,and we accept the entire institutional arrangement based on the Constitution of the PRC.
00:39:04.621,00:39:06.240,他可能不一定十全十美,00:39:04.480,00:39:06.280,It may not be perfect.
00:39:06.241,00:39:07.980,我们再将改革在家完善,00:39:06.280,00:39:08.760,That’s why we have been seeking reform and improvement.
