00:32:20.840,00:32:22.480,两岸终将统一,00:32:20.840,00:32:22.600,"The two sides across the strait will eventually reunify,"
00:32:22.480,00:32:23.560,必定统一,,,
00:32:23.560,00:32:24.600,一定会统一,00:32:22.600,00:32:24.660,"we must reunify,
we will definitely reunify,"
00:32:24.600,00:32:25.600,而且我也觉得说,,,
00:32:25.600,00:32:27.360,我这一辈子一定会看到,00:32:24.660,00:32:27.360,and I believe I can see it in my life.
00:32:27.560,00:32:28.320,我觉得,00:32:27.560,00:32:28.720,"I think,"
00:32:28.600,00:32:30.400,中国人要有一个底气,00:32:28.720,00:32:31.880,the Chinese people must be confident and assertive.
00:32:30.400,00:32:31.880,要有一个自信,,,
00:32:31.880,00:32:34.480,就是我们中国人这样的领土,00:32:31.880,00:32:35.380,"China has its own territory, its own land,"
00:32:34.520,00:32:35.480,这样的国土,,,
00:32:35.520,00:32:36.720,这样的人民,00:32:35.520,00:32:36.720,and its own people -
00:32:36.720,00:32:38.560,我们要走自己的路,00:32:36.720,00:32:38.560,we must walk our own path.
00:32:38.560,00:32:39.400,你想想看,,,
00:32:39.400,00:32:41.760,如果大陆是用台湾的方式,00:32:38.560,00:32:41.960,"Just imagine, if the mainland uses Taiwan's method,"
00:32:42.880,00:32:45.120,谁要去帮助贫困的地方,00:32:42.680,00:32:45.120,then who will help the poor areas?
00:32:45.600,00:32:47.080,每个人上海人,00:32:45.600,00:32:48.440,"For example, Shanghainese will just need to think about their own interests."
00:32:47.080,00:32:48.640,只要管自己的利益就好,,,
00:32:48.720,00:32:50.200,上海人为什么要帮助别人,00:32:48.540,00:32:50.400,Why should they help others?
00:32:50.240,00:32:51.680,所有的贫富不均,00:32:50.400,00:32:52.980,And no one will help resolve the rich and poor divide.
00:32:51.720,00:32:52.880,没有人要帮助,,,
00:32:53.080,00:32:55.320,所以那样子的一种民主的体制,,,
00:32:55.320,00:32:56.560,所谓民主的体制,00:32:53.080,00:32:59.620,"Therefore, this so-called democratic system devastates human rights most."
00:32:56.600,00:32:59.880,其实是一个最掠夺人权的体制,,,
00:32:59.920,00:33:00.240,好,,,
00:33:00.240,00:33:00.960,谢谢,00:32:59.920,00:33:01.280,Thank you.
00:33:01.320,00:33:02.000,谢谢,00:33:01.320,00:33:02.840,Thank you.
00:33:06.400,00:33:06.600,好,,,
00:33:06.600,00:33:08.080,谢谢两位给出的演讲,00:33:06.600,00:33:08.260,Thank you both for the keynotes.
00:33:08.120,00:33:09.080,刚才张教授特别,,,
00:33:09.120,00:33:09.600,说,,,
00:33:09.720,00:33:11.800,台湾的这样的一个现状,00:33:08.260,00:33:13.200,Professor Zhang gave us a few insights about Taiwan.
00:33:11.800,00:33:13.200,就告诉我们几点启发,,,
00:33:13.200,00:33:13.960,其中有一点,,,
00:33:13.960,00:33:16.960,就真的要摆脱西方的那种范式,00:33:13.200,00:33:16.940,One of them is to break away from the Western paradigm.
00:33:17.000,00:33:18.400,要从里面突破出来,00:33:17.000,00:33:18.440,Step out of it.
00:33:18.400,00:33:19.840,刚才黄女士也特别说,,,
00:33:19.840,00:33:21.080,台湾目前的困境,00:33:18.440,00:33:21.500,Ms Huang also mentioned that Taiwan’s current problem is
00:33:21.080,00:33:21.800,它就是所谓的,,,
00:33:21.800,00:33:24.040,西方的模式的这种困境,00:33:21.500,00:33:24.160,the so-called Western model predicament.
00:33:24.160,00:33:25.960,这样的困境就放在眼前,00:33:24.160,00:33:27.660,Can Taiwanese break through such a predicament?
00:33:26.000,00:33:27.920,台湾人自己能不能突破,,,
00:33:27.960,00:33:29.120,我自己比较悲观,00:33:27.960,00:33:29.480,I am relatively pessimistic.
00:33:29.160,00:33:31.320,因为一旦进入西方这个模式,00:33:29.480,00:33:31.400,"Because once entering this Western model,"
00:33:31.480,00:33:33.600,我老说就要么希望到失望,00:33:31.480,00:33:35.060,"as I always said, it would either go from hope to disappointment or hope to despair."
00:33:33.640,00:33:34.880,要么希望到绝望,,,
00:33:34.880,00:33:36.360,很难再跳出来的,00:33:35.060,00:33:36.800,It is hard to jump out.
00:33:36.800,00:33:38.920,但台湾是可能为数不多的,00:33:36.800,00:33:40.260,"Taiwan may be one of the few places where there is still an opportunity,"
00:33:38.920,00:33:40.160,还有机遇的地方,,,
00:33:40.200,00:33:41.840,那就是和平统一之后,00:33:40.260,00:33:42.420,and the opportunity is peaceful reunification.
00:33:42.600,00:33:43.280,同意之后,,,
00:33:43.880,00:33:44.960,一是一国两制,00:33:42.740,00:33:44.980,"After reunification, even if it is ""one country, two systems"","
00:33:45.000,00:33:46.520,我想是与时俱进的,00:33:45.000,00:33:47.740,the policy will also advance with the times.
00:33:46.520,00:33:47.280,一国两制,,,
00:33:48.120,00:33:49.320,台湾的民主制度,,,
00:33:49.320,00:33:51.800,也要就我前面提过建议的,00:33:48.120,00:33:51.700,"As I suggested, Taiwan's democratic system"
00:33:51.840,00:33:54.360,更能够面向民生的,00:33:51.840,00:33:54.300,should focus more on people's livelihood
00:33:54.480,00:33:55.640,民生导向的,00:33:54.300,00:33:55.860,and be livelihood-oriented.
00:33:55.640,00:33:56.320,更包含,,,
00:33:56.320,00:34:00.040,中国传统文化因素的寻求共识,00:33:55.860,00:33:59.280,"It should also embrace more of China's traditional ""consensus-seeking thinking"""
00:34:00.040,00:34:02.120,而不寻求对抗的民主,00:33:59.280,00:34:02.120,instead of confrontation in democracy.
00:34:02.240,00:34:04.080,大陆可以提供很多的经验,00:34:02.240,00:34:04.400,The mainland can provide a lot of experience.
00:34:04.440,00:34:06.160,我觉得台湾要汲取很多的教训,00:34:04.400,00:34:06.160,I think Taiwan has a lot to learn.
00:34:06.160,00:34:07.320,这制度一定要改,00:34:06.160,00:34:07.500,This system must be changed.
00:34:07.320,00:34:10.320,我唯一比黄老师稍微乐观点,00:34:07.500,00:34:10.540,I am only slightly more optimistic than Ms. Huang on one thing:
00:34:10.600,00:34:12.040,我还是相信最终,,,
00:34:12.360,00:34:15.480,形势比人强I我可以理解,00:34:10.600,00:34:14.060,"I still believe that ""the trend is stronger than individuals""."
00:34:15.760,00:34:17.760,现在特别是台湾年轻人,00:34:14.400,00:34:17.880,"I can understand that under the current  ""Taiwan independence"" climate,"
00:34:17.800,00:34:20.040,在台独环境当中,00:34:17.880,00:34:22.360,young people in Taiwan have been experiencing increasing depression.
00:34:20.280,00:34:21.400,气氛越来越压抑,,,
00:34:21.400,00:34:22.200,坦率的说,,,
00:34:22.920,00:34:25.560,但我觉得物极必反,00:34:22.960,00:34:27.320,"Still, I believe that ""there is a reverse after the peak."""
00:34:25.600,00:34:27.160,到一个点上之后,,,
00:34:27.880,00:34:29.920,特别大陆方方面面的,00:34:27.880,00:34:31.800,The mainland also needs to progressively put measures in place.
00:34:29.920,00:34:31.800,有关的措施也要到位,,,
00:34:31.840,00:34:34.000,我相信有办法的,00:34:31.840,00:34:34.140,I believe we will find a solution.
00:34:34.920,00:34:37.120,这个就是我们在台湾存在,,,
00:34:37.160,00:34:37.600,在台湾,00:34:34.920,00:34:39.720,"This is the reason why we feel as if we were
""working as spies in our enemies"""
00:34:37.640,00:34:38.440,其实每一天,,,
00:34:38.440,00:34:40.360,都觉得在做敌后工作,,,
00:34:40.400,00:34:43.160,可是我们觉得必须要做的原因,00:34:40.400,00:34:43.160,but we think we must do it.
00:34:43.200,00:34:45.400,曾经有很多观众跟我讲说,00:34:43.520,00:34:45.720,Many audiences told me that
00:34:46.560,00:34:48.040,他已经有20年,00:34:45.920,00:34:48.340,it's been 20 years that they fear to speak out
00:34:48.480,00:34:49.840,不敢在公开场合说,00:34:48.480,00:34:50.960,that they identify as Chinese in public.
00:34:49.840,00:34:50.960,他是中国人了,,,
00:34:51.480,00:34:53.280,你可以想象那种荒谬吗,00:34:51.480,00:34:53.500,Can you imagine how absurd that is?
00:34:53.560,00:34:55.480,我们的体制就是一个中国的,00:34:53.560,00:34:55.480,Our system is one China -
00:34:55.480,00:34:56.080,台湾,,,
00:34:56.120,00:34:57.080,就是中国的领土,00:34:55.480,00:34:57.080,Taiwan is China's territory.
00:34:57.080,00:34:59.040,在台湾自己的法律体制,00:34:57.080,00:34:59.320,It is enforced in Taiwan's legal system.
00:34:59.040,00:34:59.640,就是,,,
00:34:59.720,00:35:01.560,但他不敢公开讲,00:34:59.320,00:35:02.320,"However, they just dare not publicly say that they are Chinese."
00:35:01.600,00:35:02.400,他是中国人,,,
00:35:02.440,00:35:04.120,台湾我很害怕改革,00:35:02.440,00:35:04.120,We are scared of reforms in Taiwan.
00:35:04.160,00:35:05.560,每次都举出来一个理由,,,
00:35:05.560,00:35:06.880,说老百姓说很讨厌,00:35:04.160,00:35:07.440,"Every time they come up with a reason, saying ""the people hate this"""
00:35:07.440,00:35:08.440,然后我为了老百姓,,,
00:35:08.440,00:35:09.720,讨厌我门来改革,00:35:07.440,00:35:09.720,"and ""I'm doing this for the people""."
00:35:09.720,00:35:11.040,然后我们就私底下讲,00:35:09.720,00:35:12.240,Then they did a lot of tricks under the counter
00:35:11.080,00:35:12.240,搞那么浓厚,,,
00:35:12.320,00:35:13.920,变成图利我更多,00:35:12.320,00:35:13.920,so that it will benefit themselves more.
00:35:13.960,00:35:15.320,然后老百姓更痛苦,00:35:13.960,00:35:15.520,But people will suffer even more.
00:35:15.320,00:35:17.680,但老百姓已经投完票了,00:35:15.520,00:35:17.680,"But The people have already voted,"
00:35:17.720,00:35:18.720,他只好继续在等,,,
00:35:18.720,00:35:20.640,下面四年再来改变,00:35:17.720,00:35:20.900,so they have to wait for the next four years before they can change anything.
00:35:20.640,00:35:22.520,然后下面四年我在操作,00:35:20.900,00:35:22.520,Then they would do the same manipulation four years later -
00:35:22.560,00:35:23.680,我再找俊男美女,,,
00:35:23.680,00:35:24.600,然后在这边唱歌,00:35:22.560,00:35:24.980,"getting more good-looking men and women to dance on the stage,"
00:35:24.640,00:35:25.080,跳舞,,,
00:35:25.080,00:35:26.000,我又当选,00:35:25.080,00:35:26.620,and then re-election is secured.
00:35:26.680,00:35:28.280,所以永远无解悟,00:35:26.680,00:35:29.840,This dilemma of democracy will not find a solution.
00:35:28.280,00:35:30.120,所以民主的困境,,,
00:35:30.120,00:35:31.960,台湾是民主自己的困境,00:35:29.840,00:35:32.340,Taiwan has this democracy dilemma and
00:35:32.000,00:35:33.760,跟台湾自己本身的,,,
00:35:33.800,00:35:35.960,独特架构下的困境,00:35:32.340,00:35:35.960,the predicament in its [social] structure.
00:35:36.160,00:35:38.360,我的感觉是越快统一,00:35:36.160,00:35:38.360,"I feel that the faster the reunification,"
00:35:38.360,00:35:40.440,才能够越快的解决这个问题,00:35:38.360,00:35:40.620,the faster this problem can be solved.
00:35:40.480,00:35:41.800,就是靠台湾自己,,,
00:35:41.800,00:35:43.000,很难解决这个问题,00:35:40.620,00:35:43.020,It is challenging for Taiwan to solve the problem by itself.
00:35:43.000,00:35:44.600,人是没有办法拉着自己的头发,,,
00:35:44.640,00:35:46.440,把自己拔离地面的,00:35:43.020,00:35:46.440,A person cannot pull themselves off the ground by pulling their hair.
00:35:46.480,00:35:47.440,就像您刚才说,,,
00:35:47.440,00:35:48.640,台湾的政治生态,00:35:46.480,00:35:49.360,"If you follow Taiwan's news,"
00:35:48.640,00:35:49.680,可能大家去关注,,,
00:35:49.720,00:35:51.720,台湾地区新闻的人都会发现,00:35:49.380,00:35:53.260,you will find that the PMs have physical conflicts a lot.
00:35:51.720,00:35:52.640,他们的所谓的议员,,,
00:35:52.760,00:35:53.600,经常会打架,,,
00:35:53.600,00:35:54.640,您刚刚也说了,00:35:53.420,00:35:54.640,"As you mentioned,"
00:35:54.680,00:35:56.160,经常会上演全武行,00:35:54.680,00:35:57.780,"they often put on a show of ""gang fights"" with total disregard of any manners."
00:35:56.520,00:35:57.760,然后斯文扫地,,,
00:35:57.800,00:35:58.560,让大家看的,,,
00:35:58.560,00:35:59.640,瞠目结舌,00:35:57.780,00:35:59.640,It makes everyone astonished.
00:35:59.680,00:36:01.400,这个也是台湾整个政治生态的,00:35:59.680,00:36:02.440,It is a manifestation of Taiwan's political ecology.
00:36:01.400,00:36:02.640,一种外化的表现,,,
00:36:02.640,00:36:04.360,前几天我还看到一条新闻,00:36:02.640,00:36:04.620,"A few days ago, I also saw news saying that"
00:36:04.400,00:36:05.560,说他们的所谓的议员,,,
00:36:05.600,00:36:07.280,在打架的时候,00:36:04.620,00:36:09.900,"the PMs used ""screaming rubber chickens"" when they fought."
00:36:07.280,00:36:08.360,就打嘴仗的时候,,,
00:36:08.360,00:36:10.280,还按那种惨叫鸡,,,
00:36:10.440,00:36:11.480,可能是一种会,,,
00:36:11.480,00:36:11.800,一按,,,
00:36:11.800,00:36:13.320,就发出这种惨叫的声音,00:36:10.440,00:36:13.320,It is a toy that makes a screaming sound when you press it.
00:36:13.360,00:36:14.560,结果整个会场里面,,,
00:36:14.560,00:36:15.880,就惨叫声不断,00:36:13.360,00:36:15.880,"As a result, the hall was filled with noisy screams."
00:36:16.160,00:36:17.400,真的斯文扫地,00:36:15.900,00:36:17.500,It was truly disgraceful.
00:36:17.400,00:36:19.440,可是就是这样一种政治生态,,,
00:36:19.480,00:36:20.640,就是这样的一些人,00:36:17.500,00:36:23.040,"However, it is such people who are, in their own words, ""serving the people""."
00:36:20.640,00:36:23.320,在为老百姓所谓的在为做事,,,
00:36:23.320,00:36:25.200,但其实老百姓并没有,,,
00:36:25.320,00:36:26.280,真正的感受到,00:36:23.320,00:36:27.440,But the people do not see any social development happening.
00:36:26.280,00:36:27.440,社会发展的利益,,,
00:36:27.440,00:36:28.840,所以接下来我们要开放,00:36:27.440,00:36:29.260,"So next, let's open up the discussion."
00:36:28.840,00:36:29.200,讨论,,,
00:36:29.200,00:36:30.520,大家对于台湾问题,00:36:29.260,00:36:31.720,What are your opinions on the Taiwan issue?
00:36:30.520,00:36:31.720,有些什么样的观点,,,
00:36:31.720,00:36:32.960,你们的思考在哪,00:36:31.720,00:36:32.960,What are your thoughts?
00:36:33.160,00:36:36.200,我是来自上海大学的一名研究生,00:36:33.160,00:36:36.200,I am a graduate student at Shanghai University.
00:36:36.280,00:36:38.640,我以前有很多台湾的同学,00:36:36.280,00:36:38.640,I got many classmates from Taiwan.
00:36:38.800,00:36:39.720,然后他们说,,,
00:36:39.720,00:36:41.160,如果以后打仗的话,00:36:38.800,00:36:41.160,"They said that if there was a war in the future,"
00:36:41.160,00:36:43.600,他们还是会去台湾那边当兵,00:36:41.160,00:36:43.600,they would still serve as soldiers in Taiwan.
00:36:43.600,00:36:45.800,然后可能子弹还会设想,00:36:43.600,00:36:46.220,And their bullets would shot toward us.
00:36:45.800,00:36:46.640,我们看,,,
00:36:46.880,00:36:48.160,你们都已经讨论到,00:36:46.320,00:36:48.800,"Wow, you have already discussed such details!"
00:36:48.200,00:36:48.800,这个程度,,,
00:36:48.880,00:36:49.840,以前初中的时候,,,
00:36:49.880,00:36:51.840,然后同学现在已经回去服役了,00:36:48.880,00:36:51.800,"It was in junior high school,
and he is serving in the military now."
00:36:52.200,00:36:53.480,他不是自愿的,00:36:52.000,00:36:53.480,Not voluntarily.
00:36:53.480,00:36:54.280,他如果不回去,,,
00:36:54.280,00:36:55.160,他变逃兵,00:36:53.480,00:36:56.520,"If he does not go back,
he will become a deserter and sent to jail."
00:36:55.560,00:36:55.840,然后,,,
00:36:55.880,00:36:56.560,他要坐牢,,,
00:36:56.560,00:36:58.080,这也是台湾的当地,00:36:56.560,00:36:59.160,This is a local regulation in Taiwan.
00:36:58.120,00:36:59.160,特别的一种规定,,,
00:36:59.480,00:37:01.120,然后今天我的问题,00:36:59.480,00:37:01.560,My question today is that
00:37:01.960,00:37:03.280,最近香港问题,,,
00:37:03.600,00:37:05.000,一直在刺痛着我们的神经,00:37:01.960,00:37:05.000,the Hong Kong issue has been on our nerves recently.
00:37:05.000,00:37:05.520,然后我的问题,,,
00:37:06.200,00:37:09.520,与台湾的台独势力相比,00:37:05.000,00:37:08.740,"Compared with ""Taiwan separatists"","
00:37:09.520,00:37:11.480,港独势力最近的所作所为,,,
00:37:11.480,00:37:12.400,是否在国际上,00:37:08.740,00:37:14.400,"have the recent actions of the ""Hong Kong separatists"" caused a more negative impact internationally?"
00:37:12.400,00:37:13.320,造成了,,,
00:37:13.360,00:37:14.760,更加负面的影响,,,
00:37:14.760,00:37:15.960,然后这两种势力,,,
00:37:16.000,00:37:16.720,它们之间,00:37:14.760,00:37:18.160,What are the similarities and differences between these two forces?
00:37:16.720,00:37:18.160,有什么相同点和不同点,,,
00:37:18.800,00:37:20.040,共同点很简单,00:37:18.800,00:37:20.320,Their similarity is simple:
00:37:20.040,00:37:21.640,都将走向灭亡,00:37:20.320,00:37:23.120,they will perish.
00:37:22.040,00:37:23.200,这毫无疑问的,,,
00:37:23.720,00:37:24.760,不同是有一点不同,00:37:23.560,00:37:24.760,"For differences,"
00:37:24.760,00:37:27.160,因为港图是个比较新的东西,00:37:24.760,00:37:27.160,"""Hong Kong separatism"" is a relatively new thing."
00:37:27.160,00:37:28.440,如果我没有记错,00:37:27.160,00:37:28.600,"If I remember correctly,"
00:37:28.440,00:37:30.240,就是几年前开始,,,
00:37:30.320,00:37:32.160,香港学联搞了一个杂志,00:37:28.600,00:37:32.160,the Hong Kong Federation of Students started a magazine a few years ago.
00:37:32.160,00:37:33.480,里边要登文章,,,
00:37:33.480,00:37:35.800,要探讨香港独立的可能性,00:37:32.300,00:37:35.940,"Their articles started to explore the possibility of ""Hong Kong independence""."
00:37:36.440,00:37:38.480,所以它根基更加薄弱,00:37:36.440,00:37:38.620,Their theories have an even weaker foundation.
00:37:38.760,00:37:40.600,台独恐怕可以追溯到,00:37:38.760,00:37:40.600,"As for ""Taiwan independence"","
00:37:41.680,00:37:42.560,四五年,,,
00:37:42.560,00:37:43.920,日本投降以后,00:37:41.680,00:37:43.920,it can be traced back to Japan's surrender in 1945.
00:37:43.920,00:37:46.440,他就留了一部分人就搞台独,00:37:43.920,00:37:46.960,"Some Japanese were left on the island to promote ""Taiwan independence."""
00:37:47.280,00:37:48.280,在两蒋时期,00:37:47.280,00:37:48.280,"In the ""Two Chiangs"" period,"
00:37:48.280,00:37:49.920,他对共产党是镇压的,00:37:48.280,00:37:51.360,Communist Party and Taiwan separatism were both suppressed.
00:37:49.920,00:37:51.360,对台独也是镇压的,,,
00:37:51.360,00:37:52.560,所以我记得我在这讲过,,,
00:37:52.560,00:37:53.880,当时李敖讲的故事,00:37:51.360,00:37:53.880,I remember that I told you about Li Ao's story before.
00:37:53.920,00:37:55.560,他出过国民党的牢,00:37:53.920,00:37:55.620,He was in the KMT's prison.
00:37:55.600,00:37:57.040,他说台独全是孬种,00:37:55.620,00:37:58.080,He said the Taiwan separatists were a bunch of cowards.
00:37:57.160,00:37:57.600,对不对,,,
00:37:57.600,00:37:59.480,他觉得被抓的最后,,,
00:37:59.840,00:38:02.160,绝大部分全是清供,00:37:58.080,00:38:03.140,Mostly prisoners were pro-Communist or Communists party members.
00:38:02.200,00:38:03.200,或者共产党人,,,
00:38:03.320,00:38:05.040,到最后就一个是台独,,,
00:38:05.040,00:38:06.720,后来发现台独还是个神经病,00:38:03.320,00:38:07.560,"There was only one ""Taiwan independence"" guy who they found out later was mentally ill."
00:38:07.680,00:38:09.320,所以他觉得他没有真正胆量,00:38:07.680,00:38:09.320,Hence Li Ao felt that they had no guts.
00:38:09.520,00:38:10.720,当时李敖讲的话,00:38:09.520,00:38:10.720,That's what Li Ao said.
00:38:10.760,00:38:11.960,但背后也是反映了,,,
00:38:12.360,00:38:13.280,当时,00:38:10.760,00:38:14.540,It somehow reflects how Taiwan separatism was controlled
00:38:13.680,00:38:14.600,两蒋的时期,,,
00:38:14.600,00:38:16.160,他对这个是控制的,00:38:14.600,00:38:16.160,"in the ""Two Chiangs"" period."
00:38:16.160,00:38:18.240,但后来搞民主化之后,00:38:16.380,00:38:18.680,"With the beginning of democratization,"
00:38:18.680,00:38:20.360,台独特别帮民进党,,,
00:38:20.400,00:38:22.320,全部变成正式的政党,00:38:18.680,00:38:22.320,"""Taiwan separatists"" helped the DPP become a formal party,"
00:38:22.360,00:38:25.480,然后开始甚至走上了政治舞台,00:38:22.360,00:38:25.480,and they even stepped onto the political arena.
00:38:25.480,00:38:27.040,是在这么一个过程,00:38:25.480,00:38:27.200,This is the process.
00:38:27.040,00:38:29.120,但好在对台独,,,
00:38:29.120,00:38:30.480,我们非常明确的,00:38:27.200,00:38:31.720,"Fortunately, we have a very clear ""Anti-Secession Law""  for these separatists，"
00:38:31.120,00:38:32.200,反国家分裂法,,,
00:38:32.240,00:38:33.920,2005年通过的,00:38:32.240,00:38:34.000,which was passed in 2005.
00:38:34.080,00:38:36.320,其中提出几个条件,00:38:34.080,00:38:36.320,It states several conditions
00:38:36.760,00:38:37.400,在这种情况下,,,
00:38:37.440,00:38:39.240,我们将采用非和平的手段,00:38:36.760,00:38:39.820,under which we can resort to non-peaceful measures.
00:38:40.240,00:38:42.440,对港独我觉得,00:38:40.240,00:38:43.260,"Regarding ""Hong Kong separatism"", if you have read"
00:38:42.560,00:38:43.840,大家你有没有仔细看,,,
00:38:43.840,00:38:46.680,这次十九届四中全会公报里边有,00:38:43.280,00:38:47.680,about the communique of the Fourth Plenary Session of the 19th Central Committee.
00:38:46.680,00:38:47.120,一句话,,,
00:38:47.760,00:38:52.160,叫做是建设健全,00:38:47.760,00:38:56.900,"It says: ""Establish and improve the legal system and enforcement mechanism of Hong Kong SAR"
00:38:53.360,00:38:55.120,特别行政区,,,
00:38:55.160,00:38:57.120,维护国家安全的,,,
00:38:57.120,00:38:58.080,法律制度,,,
00:38:58.080,00:38:59.560,和执行机制,00:38:57.120,00:38:59.560,"to safeguard national security."""
00:38:59.800,00:39:01.440,这个话是掷地有声的,,,
00:39:02.280,00:39:05.000,我们这个觉得讲得非常好,00:38:59.800,00:39:04.800,This voices our position out loud.
00:39:05.200,00:39:07.040,下面我们看怎么来落实,00:39:04.800,00:39:07.040,Let's wait and see how it implements.
00:39:07.120,00:39:09.240,所以最终是我还是这句老话,00:39:07.120,00:39:09.680,"In the end, I hold the same opinion:"
00:39:09.880,00:39:12.560,不管他们一时会多么的猖狂,00:39:09.880,00:39:15.080,"no matter how rampant they are at the moment, the trend does not stand with them."
00:39:12.840,00:39:15.720,但是这个大事不在他们一边,,,
00:39:16.160,00:39:18.480,那么中国崛起的势头不可主导,00:39:16.160,00:39:18.740,The rise of China is unstoppable.
00:39:18.520,00:39:20.920,而且我相信在我们新时代,00:39:18.740,00:39:22.540,"Also, I believe that in our new era,
we can solve all these problems."
00:39:20.920,00:39:22.400,这些问题都要把它解决,,,
00:39:22.720,00:39:24.720,它们的共同点就是说,00:39:22.720,00:39:24.720,"In my opinion, what they have in common is:"
00:39:24.720,00:39:25.920,第一项老师讲,00:39:24.720,00:39:26.960,"first, as Prof. Zhang said,
they will definitely perish."
00:39:25.960,00:39:27.080,是绝对会灭亡,,,
00:39:27.080,00:39:28.160,不可能成功的,,,
00:39:28.360,00:39:30.280,两岸终将统一,00:39:27.060,00:39:30.180,"They won't succeed,
and China will eventually be unified."
00:39:30.320,00:39:32.440,第二个是其实都存在着,,,
00:39:32.480,00:39:33.520,香港跟台湾,00:39:30.320,00:39:35.920,"Secondly is that Hong Kong and Taiwan were once colonies,"
00:39:33.560,00:39:35.920,都曾经作为殖民地,,,
00:39:35.960,00:39:38.320,所以留下了一个很大的空间,,,
00:39:38.360,00:39:39.960,让外国的势力,00:39:35.960,00:39:41.080,"so there is plenty of room
for foreign forces to intervene."
00:39:40.000,00:39:41.800,可以介入来操作,,,
00:39:41.840,00:39:44.960,台湾过去有日本留下来的很多,00:39:41.840,00:39:45.760,Taiwan has a lot of influence left by Japan.
00:39:44.960,00:39:45.760,影响力,,,
00:39:45.760,00:39:47.560,而现在因为台湾在经济,,,
00:39:47.560,00:39:48.560,在贸易上面,,,
00:39:48.560,00:39:49.440,跟日本,00:39:45.760,00:39:51.640,Now Taiwan is very close to Japan in economics and trade.
00:39:49.480,00:39:50.280,是,,,
00:39:50.400,00:39:51.640,非常紧密的,,,
00:39:51.640,00:39:55.680,甚至日本常常会跟台湾的公司,00:39:51.640,00:39:57.780,Japan often unites with Taiwanese companies to enter the mainland market.
00:39:55.680,00:39:56.440,联合,,,
00:39:56.440,00:39:58.040,然后来打大陆的市场,,,
00:39:58.080,00:39:59.240,因为他们知道,,,
00:39:59.240,00:39:59.880,日本公司,,,
00:39:59.880,00:40:00.680,直接打到市场,00:39:58.080,00:40:01.840,They know that Japanese companies cannot win the mainland market directly.
00:40:00.680,00:40:01.520,打不起来,,,
00:40:01.520,00:40:01.880,好,,,
00:40:02.120,00:40:03.360,这样就有利益,00:40:01.840,00:40:03.800,So they share common interests.
00:40:03.360,00:40:04.240,所以为什么,,,
00:40:04.240,00:40:06.560,以前我的节目在台湾,00:40:03.800,00:40:09.320,"Therefore, when I used to talk about Japan's colonial exploitation on my shows,"
00:40:07.040,00:40:08.320,我最常讲,,,
00:40:08.600,00:40:09.640,日据时代,,,
