00:39:28.640,00:39:29.750,我算是知道了,00:39:27.300,00:39:29.338,What is the use of even the finest jewelry?
00:39:30.120,00:39:33.470,谁的话都没有皇后娘娘的话管用,00:39:29.800,00:39:34.832,"I have finally learned that no one
carries more weight than the Empress."
00:39:34.160,00:39:34.950,那是自然,,,
00:39:35.240,00:39:36.110,除了太后,,,
00:39:36.360,00:39:38.660,皇后娘娘可是宫里最大的女人了,00:39:35.360,00:39:40.400,"Of course, the Empress is the most important woman
in the palace other than the Empress Dowager."
00:39:39.480,00:39:40.590,出了这样的事,,,
00:39:41.200,00:39:44.980,我才知道什么都是靠不住的,00:39:40.520,00:39:46.431,Now I know I can never count on anyone else.
00:39:45.920,00:39:48.300,眉姐姐平日里与我姐妹相称,00:39:46.926,00:39:49.834,"Meizhuang addresses me as her sister,"
00:39:48.800,00:39:52.750,有事相求 便唯恐避之不及,00:39:49.834,00:39:53.920,"but in a crisis, stays away from me like a plague."
00:39:53.480,00:39:54.540,奴婢倒觉得,,,
00:39:55.000,00:39:57.230,莞贵人倒是对小主真心,00:39:54.500,00:39:58.560,"My Lady, I feel that Lady Sourire is sincere to you."
00:39:58.840,00:40:01.400,谁对我好 我心里有数,00:39:59.800,00:40:02.897,I know in my heart who is good to me.
00:40:02.000,00:40:05.190,奴婢觉得靠旁人不如靠自己,00:40:03.236,00:40:06.576,"My Lady, I think you should rely on
yourself rather than anyone else."
00:40:05.840,00:40:08.030,小主想为大人和夫人争气,,,
00:40:08.480,00:40:09.790,不如自己得宠,,,
00:40:10.080,00:40:12.150,扬眉吐气来得更痛快,00:40:07.120,00:40:13.800,"You can gain favor for yourself to ""smooth
your furrowed eyebrows"" and make your parents proud."
00:40:13.080,00:40:17.430,我既没那个本事 也没那个机会,00:40:14.026,00:40:19.053,"I'm incapable of that, and devoid of a chance to do so."
00:40:18.040,00:40:21.150,小主有心就好 有心就有机会,00:40:19.327,00:40:22.527,"As long as you have the heart, My Lady,
there will be a way."
00:40:35.720,00:40:36.550,小主怕热,,,
00:40:36.840,00:40:38.270,你怎么不在里面给小主扇扇子,00:40:37.000,00:40:39.551,"Why are you not fanning My Lady inside
when it's so hot right now?"
00:40:38.680,00:40:39.430,皇上在呢,,,
00:40:39.680,00:40:40.710,我怎么敢在里面待呀,,,
00:40:41.400,00:40:43.070,这些蝉闹得小主睡不好,00:40:39.740,00:40:42.229,His Majesty is here. I don't dare to stay in.
00:40:43.400,00:40:44.910,我出来粘走这些小东西,00:40:42.400,00:40:46.460,"I'm using a sticky pole to catch the cicadas
so My Lady can have better sleep."
00:40:46.000,00:40:47.220,光粘这里有什么用,,,
00:40:47.560,00:40:48.990,外面的院子里多得是呢,00:40:46.864,00:40:48.540,Only catching the cicadas on this tree?
00:40:49.360,00:40:50.500,要一并粘去才安静,00:40:48.540,00:40:51.980,"There are many more trees in the outer yard.
It won't be quiet until you catch them all."
00:40:51.800,00:40:52.910,你不陪我一起呀,,,
00:40:54.040,00:40:55.630,小主让我摘了几朵荷花,00:40:52.226,00:40:54.533,"Hey, aren't you going to do it with me!"
00:40:55.920,00:40:57.310,说午觉睡醒以后要看的,00:40:55.226,00:40:58.620,"My Lady sent me to collect some lotus flowers
so she could see them after her nap."
00:40:57.680,00:40:58.590,我去找个瓶子插上,00:40:58.620,00:41:00.140,I'm going to put them in a vase.
00:41:07.360,00:41:08.190,皇上饶恕,,,
00:41:08.440,00:41:09.580,奴婢不知皇上在这里,00:41:08.274,00:41:11.149,"I beg Your Majesty's pardon.
I didn't know Your Majesty was here."
00:41:10.000,00:41:10.980,实是无心之失啊,00:41:11.149,00:41:12.659,I didn't mean to interrupt.
00:41:12.200,00:41:14.430,小主 浣碧不是有意的,00:41:13.300,00:41:16.140,"My Lady, I didn't mean to."
00:41:17.000,00:41:20.230,你就是那个爱穿绿衫子的浣碧,00:41:18.000,00:41:21.580,You must be the Jade who likes to wear jade.
00:41:21.160,00:41:23.540,奴婢正是 皇上好记性,00:41:22.400,00:41:24.960,"Yes, Your Majesty has a good memory."
00:41:27.840,00:41:29.190,放下东西 下去吧,00:41:28.880,00:41:30.805,You may leave after you put away the flowers.
00:41:29.960,00:41:30.630,是,00:41:31.220,00:41:32.161,Yes.
00:41:48.680,00:41:51.110,为何要把荷花放在宽口瓶里,00:41:50.060,00:41:52.390,Why did you put the flowers in a big bowl?
00:41:52.240,00:41:53.070,回皇上,,,
00:41:53.600,00:41:56.060,奴婢心想 要是花浮在瓶里,00:41:53.640,00:41:58.737,"Your Majesty, I was hoping to keep them floating
in the bowl the same way they're blooming on the lake."
00:41:56.400,00:41:57.460,就好比开在水上,,,
00:41:57.880,00:41:59.070,会更加好看一些,00:41:58.737,00:42:00.737,They will look more beautiful.
00:42:01.400,00:42:03.990,你长得俏丽 心思也细巧,00:42:02.240,00:42:05.558,You have a pretty face and an even more beautiful mind.
00:42:04.800,00:42:05.590,谢皇上,00:42:05.860,00:42:07.480,I thank Your Majesty.
00:42:15.040,00:42:16.790,果然是你调教出来的人,00:42:16.126,00:42:18.108,Even your maid takes after you.
00:42:23.000,00:42:36.000,"[contact translators] carsenwei@yahoo.com
[subtitles subscription] liberapay.com/ZHZSubbers",00:42:22.620,00:42:34.620,"Translators: The Magpie Bridge Brigade 鹊桥小队翻译组
Support our volunteers: magpiebridgebrigade.cn
Twitter/FB/IG @BrigadeMagpie 公众号/微博: 鹊桥小队翻译组"
00:42:36.000,00:42:39.000,"Theme: The Lonely Phoenix
[phoenix is the symbol of an empress]",00:42:34.620,00:42:39.640,"Theme: The Phoenix Taking Flight
[phoenix is the symbol of an empress]"
00:42:41.000,00:42:59.000,"I dimly recall the colorful blooms in every summer.
They are as distant as the autumn moon in the water.",00:42:41.000,00:42:59.000,"The dreams I dimly recall;
The past I hardly remember,
amidst the autumn moons and the spring flowers.
Like the moon's reflection on water
or flowers seen through mist - floating and drifting."
00:42:59.000,00:43:19.000,"He loved me with a volatile heart.
And before I knew it, we fell apart.",00:42:59.000,00:43:19.000,"The joyous sounds you brought;
The silence you left;
Changing faster than clouds can turn to rain.
Our minds resonated;
Our hearts beat in unison;
But we lost what we once possessed."
00:43:19.000,00:43:36.000,"Behind me are the promises and longing.
Before me lie the flute and the zither.",00:43:19.000,00:43:36.000,"A poem to converse;
A melody to accompany;
A heart to bind to mine.
I hoped for endless longing and eternal promise,
but I’m left with only the flute and the zither."
00:43:36.000,00:43:54.000,"I loved you with my body and soul
But you hurt me from head to toe.",00:43:36.000,00:43:54.000,"With affection, I pleased;
With my heart, I committed;
With my arms, I embraced.
I desired to be remembered;
Desired to be cherished;
Why am I only hated and deceived?"
00:43:54.000,00:44:02.000,"My wish ran athwart
and I ended up a fool of my destiny.",00:43:54.000,00:44:02.000,"My wish ran against my will.
Behold the mockery of destiny and the game of fate."
00:44:02.000,00:44:14.000,My love was the wind-swept flowers from a tree.,00:44:02.000,00:44:14.000,"My unwavering love is gone
like flowers swept away in the wind."
00:44:14.000,00:44:33.000,"A plum bloomed in winter hoping for a fruitful summer.
But the irresistible winds of destiny destroyed her wish.",00:44:14.000,00:44:33.000,"Praying for a bright moon;
Praying for a rising sun;
Dreaming to bask in the spring breezes.
But the unsparing northern winds carry snow and rain
to destroy the aspirations of the plum tree."
00:44:33.000,00:44:41.000,"You can hear the flapping of a phoenix
but you will never see it.",00:44:33.000,00:44:41.000,"A phoenix about to take flight rustles its wings
but the arc of its flight is unseen."
00:44:41.000,00:44:47.600,What you see is the falling leaves from the phoenix tree.,00:44:41.000,00:44:47.600,"The phoenix tree sways in the wind,
shedding memories in the whispers of the falling leaves."
00:44:51.000,00:45:04.000,The falling leaves from the phoenix tree.,00:44:51.000,00:45:04.000,"The phoenix tree sways in the wind,
shedding memories in the whispers of the falling leaves."
