00:13:27.080,00:13:29.460,只是本宫看见温宜那孩子,,,
00:13:30.200,00:13:33.030,便想起本宫的弘晖,00:13:28.140,00:13:36.180,"Only, I couldn't help thinking of my son Honghui,
on the ceremony of his first birthday."
00:13:33.320,00:13:34.790,周岁礼时的样子,,,
00:13:36.200,00:13:37.910,大阿哥若还在的话,00:13:36.900,00:13:39.180,If the First Prince were still with us ...
00:13:38.400,00:13:39.990,弘晖若还在,00:13:39.680,00:13:41.698,"If Honghui were with us,"
00:13:40.880,00:13:43.230,一定比三阿哥长得高些,00:13:42.100,00:13:45.033,"he would have grown taller than the Third Prince,"
00:13:43.840,00:13:45.590,长得更加好看些,00:13:45.033,00:13:47.080,and more handsome.
00:13:46.040,00:13:47.630,肯定比三阿哥聪明多了,00:13:47.316,00:13:49.225,And much smarter than the Third Prince.
00:13:50.720,00:13:51.750,是啊,00:13:51.920,00:13:53.475,Indeed.
00:13:52.680,00:13:55.110,弘晖两岁时便会认字了,00:13:53.852,00:13:57.117,"Honghui began to read characters
when he was only two years old."
00:13:57.200,00:13:59.390,三阿哥根本就比不上他,00:13:58.500,00:14:00.829,The Third Prince has nothing that compares.
00:14:01.200,00:14:02.470,娘娘正当盛时,,,
00:14:03.160,00:14:04.870,肯定还能再添一位阿哥,00:14:02.400,00:14:06.040,"Your Majesty is in your prime.
You will certainly have one more prince."
00:14:06.200,00:14:08.030,本宫都年逾四十了,,,
00:14:09.000,00:14:11.270,早已不是适合孕育之身,00:14:07.500,00:14:12.540,"I'm past forty years of age,
not suitable for pregnancy anymore."
00:14:12.480,00:14:14.070,何况姐姐死后,,,
00:14:14.800,00:14:17.150,皇上再未对本宫如从前那般,00:14:13.789,00:14:18.169,"And after my sister died,
His Majesty never treated me the same way."
00:14:19.000,00:14:21.990,本宫自己的身子本宫自己知道,00:14:20.000,00:14:23.240,I know the condition of my health.
00:14:22.200,00:14:23.750,怕是再也不能了,00:14:23.240,00:14:25.113,I'm afraid I'll never be able to.
00:14:24.720,00:14:26.270,皇上虽然嘴上不说,,,
00:14:26.600,00:14:28.550,但是心里还是很尊重娘娘的,00:14:26.000,00:14:29.920,"Even though His Majesty doesn't say so,
he has a lot of respect for Your Majesty in his heart."
00:14:29.960,00:14:33.350,一个女人得不到丈夫的爱,,,
00:14:34.200,00:14:36.550,只得到尊重有什么用呢,00:14:31.100,00:14:38.160,"when a woman does not have her husband's love,
what is the use of his respect?"
00:14:39.400,00:14:41.470,你是和本宫一起过来的人,00:14:40.380,00:14:42.980,You've been through all these years with me.
00:14:42.480,00:14:43.700,皇上对本宫,,,
00:14:44.120,00:14:47.190,比之昔年对姐姐如何呀,00:14:43.604,00:14:48.500,"How do you think His Majesty has treated me
compared to how he treated my sister?"
00:14:48.000,00:14:51.540,娘娘 其实在纯元皇后未进府前,,,
00:14:52.040,00:14:54.030,皇上对娘娘您也是极好的,00:14:49.180,00:14:55.360,"Your Majesty, before Empress Première entered
the family, His Majesty treated you extremely well."
00:14:57.920,00:15:01.540,皇上对本宫再好都比不过姐姐好,00:14:59.260,00:15:02.809,"His Majesty never treated me
as well as he treated my sister."
00:15:02.720,00:15:03.910,太后也是,00:15:03.911,00:15:05.711,And the Empress Dowager too.
00:15:08.120,00:15:09.830,到底本宫是庶出,,,
00:15:10.360,00:15:11.870,不比姐姐是嫡出,00:15:09.280,00:15:13.280,"After all, I am the daughter of a secondary wife
while my sister was of a primary wife."
00:15:14.360,00:15:15.830,如果弘晖还在,,,
00:15:16.480,00:15:19.910,他便是皇上的长子 又成了嫡出,00:15:15.620,00:15:21.180,"If my son Honghui were with us,
he would have been the eldest son and of a primary wife."
00:15:20.880,00:15:22.550,身份是何等尊贵呀,00:15:21.906,00:15:24.226,What a distinguished status he would have.
00:15:29.000,00:15:30.830,弘晖死的时候,00:15:30.340,00:15:32.685,"When Honghui was dying,"
00:15:33.120,00:15:35.390,外面也是这样的雨天,00:15:34.360,00:15:37.014,it was raining just like this.
00:15:40.800,00:15:45.430,剪秋啊 本宫头好痛,00:15:42.000,00:15:43.446,"Autumn,"
,,,00:15:44.320,00:15:46.300,my migraine is piercing right now.
00:15:45.920,00:15:46.950,娘娘,00:15:46.920,00:15:48.400,Your Majesty...
00:15:51.840,00:15:52.590,娘娘,00:15:52.000,00:15:53.880,Your Majesty...
,,,00:15:55.520,00:16:04.000,"Translators: The Magpie Bridge Brigade 鹊桥小队翻译组
Support our volunteers: magpiebridgebrigade.cn
Twitter/FB/IG @BrigadeMagpie 公众号/微博: 鹊桥小队翻译组"
00:16:03.720,00:16:07.710,小主这两日饮食可好 还想吐否,00:16:05.000,00:16:08.940,"My Lady, how was your appetite the last two days?
Do you still feel nauseous?"
00:16:08.280,00:16:09.630,正是这个奇怪了,,,
00:16:09.880,00:16:11.510,这两日倒不想吐了,00:16:09.355,00:16:12.949,"It's strange.
I haven't felt nauseous lately."
00:16:11.960,00:16:13.830,肚子也有些微凉发痛,,,
00:16:14.240,00:16:15.460,不知是何缘故,00:16:13.213,00:16:16.660,"But my stomach aches and feels cold.
I wonder what the reason is."
00:16:16.120,00:16:18.580,安胎的方子已为小主用下,,,
00:16:18.840,00:16:20.710,小主的身体自然安逸,00:16:17.202,00:16:22.182,"My Lady, you will continue to feel at ease
as you have been taking the prenatal tonics."
00:16:21.840,00:16:24.070,至于肚痛发凉嘛,00:16:23.180,00:16:25.620,As for the stomach pain...
00:16:25.040,00:16:27.230,小主怀孕才一月有余,,,
00:16:27.440,00:16:30.030,正常正常 小主莫担心,00:16:26.164,00:16:31.620,it is normal at one month of pregnancy.
00:16:30.760,00:16:32.550,你这样说我就放心了,00:16:31.800,00:16:33.860,I feel reassured hearing you say that.
00:16:33.160,00:16:35.030,我原以为怀孕一个多月,,,
00:16:35.360,00:16:36.790,正是要害喜的时候呢,00:16:34.226,00:16:38.120,"I thought the pregnancy symptoms
would be strong in the first month."
00:16:37.600,00:16:40.030,小主身子强健 怎会被害喜,00:16:38.200,00:16:41.200,"Nay. You are in good health, My Lady.
You would not have such symptoms."
00:16:40.280,00:16:41.950,我想小主一定会为皇上,,,
00:16:42.240,00:16:44.270,生一个健健康康的小阿哥,00:16:41.300,00:16:45.380,"I believe you will give birth to a
healthy prince for His Majesty."
00:16:45.080,00:16:46.390,那就承你吉言了,,,
00:16:47.600,00:16:48.740,采月 是,00:16:46.276,00:16:47.829,I hope I fulfill your auspicious words.
00:16:49.040,00:16:50.790,把父亲托人带来的山楂糕,00:16:48.643,00:16:50.200,"- Lunar.
- Yes."
00:16:51.040,00:16:52.070,赏些给刘太医,00:16:50.200,00:16:53.300,Grant Dr. Liu some of the hawthorn cakes my father sent.
00:16:52.320,00:16:53.270,多谢小主,00:16:53.300,00:16:54.600,"Thank you, My Lady."
00:17:04.920,00:17:08.150,这山楂糕一看便知是齐顺斋所制,00:17:05.000,00:17:09.400,"The hawthorn cakes must be
made by Qishunzhai Bakery."
00:17:09.520,00:17:10.710,齐顺斋的糕点,,,
00:17:11.040,00:17:12.350,不是前年就不做了吗,00:17:10.640,00:17:13.940,Qishunzhai was closed the year before last.
00:17:13.000,00:17:15.350,刘太医是上半年才来的行宫,,,
00:17:16.000,00:17:17.110,怎么会不知道,00:17:14.091,00:17:18.460,"Dr. Liu, you were transferred to the palace this year.
Why didn't you know?"
00:17:20.280,00:17:21.420,微臣想家时,,,
00:17:21.680,00:17:23.430,总会想起齐顺斋的点心,00:17:20.960,00:17:24.720,I always think of Qishunzhai when I miss home.
00:17:23.840,00:17:25.910,所以总觉得那家店还在,00:17:24.900,00:17:27.300,It feels as if the bakery should still be there.
00:17:26.240,00:17:28.590,刚才一时口误 望小主恕罪,00:17:27.300,00:17:29.960,I apologize for my slip of the tongue.
00:17:29.080,00:17:31.070,看来你是思乡情切了,00:17:30.240,00:17:32.340,You must be missing home a lot.
00:17:32.200,00:17:33.260,你若喜欢,,,
00:17:33.520,00:17:35.750,我让采月多给你包些带回去,00:17:33.320,00:17:37.100,I will have Lunar send you more if you like.
00:17:36.000,00:17:38.070,那微臣先谢过小主,00:17:37.280,00:17:39.540,I thank My Lady in advance.
00:17:39.000,00:17:40.220,茯苓 是,00:17:40.240,00:17:41.520,"- Poria.
- Yes."
00:17:40.480,00:17:42.550,好生送刘太医出去 是,00:17:41.520,00:17:43.920,"- See Dr. Liu out.
- Yes."
00:17:42.960,00:17:44.070,刘太医 这边请,00:17:43.920,00:17:45.740,"This way please, Dr. Liu."
00:17:44.880,00:17:46.470,微臣拜谢小主,00:17:46.065,00:17:47.745,I bow to thank My Lady.
00:18:04.400,00:18:06.910,小主歇歇吧 仔细眼睛疼,00:18:05.380,00:18:08.320,"Please take a break, My Lady.
Don't strain your eyes."
00:18:14.200,00:18:16.390,快好了 还是先绣完吧,,,
00:18:16.760,00:18:17.710,小主急什么,00:18:15.460,00:18:18.000,"This one is almost done.
I will finish it."
00:18:18.360,00:18:20.150,惠贵人才一个多月的身孕,00:18:18.000,00:18:19.460,"There's no hurry, My Lady."
00:18:20.480,00:18:21.430,还有八个月,,,
00:18:21.680,00:18:23.350,才能穿上您绣的肚兜呢,00:18:19.649,00:18:24.769,"Lady Vertu is just one month into her pregnancy.
You have eight more months to finish the bib."
00:18:24.960,00:18:26.270,要把这个先绣好,,,
00:18:27.200,00:18:28.420,若眉姐姐看到了,00:18:25.740,00:18:28.000,I must finish this as soon as possible.
00:18:28.960,00:18:31.390,她要是喜欢 我再多绣几个,00:18:28.400,00:18:32.680,"If Meizhuang likes it, I will make a few more."
00:18:32.640,00:18:34.870,你不知道 孩子长得快,,,
00:18:35.320,00:18:36.540,一会儿就长大了,00:18:34.000,00:18:37.500,You have no idea how fast a baby grows.
00:18:37.080,00:18:38.830,若不多绣几个怎么行啊,00:18:37.900,00:18:40.180,They outgrow their clothes in no time.
00:18:39.480,00:18:41.990,瞧您说的 跟自己生过似的,00:18:40.400,00:18:43.335,It's not like you've had children of your own.
00:18:47.320,00:18:48.430,我在家时,,,
00:18:49.440,00:18:51.950,常看母亲给姨娘的几个孩子,00:18:48.360,00:18:54.780,"Growing up, I watched my mother
do needlework for the concubines' children."
00:18:52.320,00:18:53.460,绣这个绣那个的,,,
00:18:54.920,00:18:56.510,所以多少知道些,00:18:56.120,00:18:58.140,That is how I have the knowledge.
00:18:57.440,00:18:59.870,奴婢失言 勾起小主伤心事,00:18:58.900,00:19:01.380,"I'm sorry to have triggered
your sad memories, My Lady."
00:19:00.280,00:19:01.390,请小主责罚,,,
00:19:02.200,00:19:03.030,快起来,00:19:01.380,00:19:02.880,I will take any punishment.
00:19:04.000,00:19:05.140,我责罚你什么,00:19:03.000,00:19:04.480,Please rise.
,,,00:19:05.320,00:19:06.867,Why would I punish you?
00:19:06.640,00:19:09.710,只是不知道母亲现下如何,00:19:08.000,00:19:11.140,But I wonder how my mother has been.
00:19:10.480,00:19:13.270,小主进宫 夫人必定面上有光,00:19:11.602,00:19:14.780,"She must be so honored
that you have entered the palace."
00:19:14.080,00:19:16.030,我不过是一个不得宠的答应,00:19:15.195,00:19:17.434,I'm just a neglected Companion.
00:19:17.200,00:19:20.630,皇上连我是谁也许都不记得,00:19:18.415,00:19:22.020,His Majesty might not even remember who I am.
00:19:24.520,00:19:26.150,不到这条龙飞的时候,00:19:25.731,00:19:28.321,The dragon will have to stay where it is
00:19:28.440,00:19:29.830,它乖乖待着就是了,00:19:29.377,00:19:31.200,before having a chance to soar.
00:19:32.640,00:19:34.030,小主 不好了,00:19:33.774,00:19:35.614,"My Lady, terrible news."
00:19:35.320,00:19:35.910,怎么了,,,
00:19:36.200,00:19:37.070,安大人出事了,00:19:36.439,00:19:37.330,What happened?
,,,00:19:37.330,00:19:38.689,Mr. An had an accident.
00:19:41.480,00:19:42.230,小主,00:19:42.620,00:19:43.820,My Lady.
00:19:46.160,00:19:46.910,姐姐,,,
00:19:48.960,00:19:49.990,姐姐救命,00:19:47.660,00:19:49.140,My sisters.
00:19:50.240,00:19:51.430,陵容 这是怎么了,00:19:50.040,00:19:51.480,"My sisters, help me!"
00:19:51.680,00:19:52.510,起来 慢慢说,00:19:51.480,00:19:53.980,"- Longrong, what happened?
- Rise. Take it easy."
00:19:52.760,00:19:55.350,姐姐 我父亲下狱了,00:19:54.000,00:19:56.640,My father is in jail!
00:19:56.040,00:19:58.190,好端端的怎么会出这样的事呢,00:19:57.100,00:19:59.620,How did that happen all of a sudden?
00:19:58.680,00:19:59.820,我收到家书,,,
00:20:00.160,00:20:02.230,说松阳县令蒋文庆,00:19:59.900,00:20:01.380,I received a letter from home saying
00:20:02.640,00:20:04.230,奉旨押送西北军粮,,,
00:20:04.800,00:20:06.790,我父亲也是随军护送之一,00:20:01.380,00:20:08.000,"while my father assisted the magistrate -
Jiang Wenqing -
transferring army provisions to the Northwest,"
00:20:07.400,00:20:10.070,谁知半路遇上敌军流兵,,,
00:20:10.720,00:20:12.190,军粮被劫走了,00:20:08.700,00:20:13.480,enemy troops attacked them halfway and robbed the provisions.
00:20:12.920,00:20:14.590,蒋文庆也临阵脱逃,,,
00:20:14.920,00:20:16.550,还带走了不少银饷,00:20:14.220,00:20:17.640,Jiang Wenqing escaped and stole lots of money.
00:20:17.600,00:20:20.990,皇上龙颜震怒 随即抓回蒋文庆,,,
00:20:21.440,00:20:23.070,和父亲一起关押着,00:20:18.700,00:20:24.260,"His Majesty, shaking with rage,
decreed my father's arrest along with Jiang Wenqing."
00:20:24.000,00:20:26.380,现在生死未定,00:20:25.200,00:20:27.820,I don't know if he will live or not.
00:20:27.480,00:20:29.430,我怕皇上一怒之下,,,
00:20:29.840,00:20:32.190,爹爹性命难保,00:20:28.820,00:20:33.120,"Given such fierce anger I'm afraid His Majesty
 will sentence my father to death!"
00:20:34.440,00:20:35.420,你可问清楚了,,,
00:20:35.720,00:20:37.630,此事你父亲真未参与其中,00:20:35.700,00:20:38.860,Did you confirm your father wasn't involved at all?
00:20:37.840,00:20:40.590,不会的 父亲一向谨小慎微,00:20:38.860,00:20:40.060,I am sure!
00:20:41.000,00:20:42.350,为人只求自保,00:20:40.060,00:20:43.360,My father has always been cautious in his dealings.
00:20:42.640,00:20:44.230,是万万不敢和蒋文庆的事情,,,
00:20:44.600,00:20:45.740,掺和在一起的,00:20:43.813,00:20:47.000,He would never involve himself in what Jiang Wenqing did.
00:20:46.840,00:20:47.950,事情还未有定论,,,
00:20:48.240,00:20:49.220,你先别急着哭,00:20:48.020,00:20:50.580,"Don't cry, Lingrong.
There's no conclusion to this matter yet."
00:20:49.680,00:20:50.900,咱们想想办法要紧,,,
00:20:51.200,00:20:51.830,是啊,00:20:50.806,00:20:52.380,We must think of a solution.
,,,00:20:52.380,00:20:53.111,Exactly.
00:20:52.040,00:20:54.830,我知道 军情本是大事,00:20:53.111,00:20:57.161,"I understand that anything concerning
the military is of great consequence."
00:20:56.840,00:21:00.830,恐怕父亲凶多吉少,00:20:57.840,00:21:02.340,I'm afraid the odds are more ominous than propitious.
00:21:02.080,00:21:03.350,你家都出了这样的事,,,
00:21:03.680,00:21:05.590,咱们自然要为你去向皇上求情,00:21:03.041,00:21:06.621,We will definitely try to speak to His Majesty on your behalf.
00:21:06.360,00:21:08.230,可是朝政上的事情,,,
00:21:08.960,00:21:10.310,咱们未必插得上嘴啊,00:21:07.700,00:21:11.600,"It's just that... we are not allowed
to pass comments on state affairs."
00:21:10.680,00:21:11.470,是啊,,,
00:21:11.720,00:21:13.190,倒也不必惊动皇上,00:21:11.700,00:21:12.700,You're right.
,,,00:21:12.820,00:21:14.680,There's no need to disturb His Majesty.
00:21:13.680,00:21:16.270,这件事情眉姐姐有法子,00:21:14.780,00:21:17.660,"In fact, Meizhuang can help me."
00:21:16.560,00:21:17.230,我,00:21:17.660,00:21:18.500,Me?
00:21:18.480,00:21:20.990,因为这件事出在济州界上,00:21:19.380,00:21:22.320,The incident happened within the jurisdiction of Jizhou.
00:21:21.640,00:21:24.790,都由眉姐姐的父亲济州协领审问,00:21:22.697,00:21:26.253,"Your father, as the region's Commander,
will be the interrogator."
00:21:27.360,00:21:31.310,眉姐姐 求您救救父亲 你先起来,00:21:28.300,00:21:32.674,"- Meizhuang, I beg of you to help my father.
- Please stand."
00:21:31.720,00:21:33.070,救救父亲 容我想想办法,,,
00:21:34.560,00:21:35.750,我想想办法,00:21:32.900,00:21:35.052,I will see what I can do.
00:21:36.880,00:21:38.310,但求姐姐垂怜,00:21:35.580,00:21:37.159,I need to think ...
00:21:38.600,00:21:42.220,一封家书即可救我父亲性命,00:21:38.000,00:21:43.500,"Please have mercy on my father.
A letter from you will be enough to save his life."
00:21:42.600,00:21:43.950,好 你放心,,,
00:21:44.840,00:21:46.110,但是为求妥当,00:21:43.700,00:21:45.620,"Of course, don't worry."
00:21:46.400,00:21:48.190,我要先去见皇上探探口风,00:21:46.039,00:21:49.839,"But I must request an audience with His Majesty
and sound out his opinion."
00:21:51.040,00:21:56.990,谢谢姐姐 陵容感激不尽,00:21:52.240,00:21:54.040,"Thank you, Meizhuang!"
00:21:57.240,00:21:59.750,陵容 先别哭了,00:21:55.400,00:21:58.556,I'm eternally grateful for your help.
,,,00:22:00.000,00:22:01.560,"Lingrong, don't cry."
00:22:09.000,00:22:10.390,惠贵人,,,
00:22:10.640,00:22:12.510,您有着身孕怎么跑出来了,00:22:10.200,00:22:11.598,"Aiyo, Lady Vertu..."
00:22:12.840,00:22:14.670,小心日头晒着您哪,00:22:11.787,00:22:13.900,What brought you here carrying the child?
00:22:15.040,00:22:16.020,皇上在里头吗,00:22:14.126,00:22:16.000,Be careful not to be affected by the heat.
00:22:16.320,00:22:17.030,在,00:22:16.100,00:22:17.404,Is His Majesty inside?
00:22:17.360,00:22:18.670,可是张廷玉大人,,,
00:22:18.920,00:22:20.390,跟隆科多大人也在,00:22:17.520,00:22:20.966,"Yes, but he's with Zhang Tingyu and General Longkodo."
00:22:20.680,00:22:22.030,小主您得多等一会儿,00:22:21.760,00:22:23.340,"I'm afraid you'll have to wait for a while, My Lady."
00:22:22.280,00:22:24.430,怎么 连隆科多大人都来了,00:22:23.340,00:22:26.420,Why is General Longkodo here?
00:22:27.120,00:22:29.680,运往西北的粮草出了点事,00:22:28.100,00:22:31.000,"An accident happened to the
army provisions for the Northwest."
00:22:30.040,00:22:32.630,事关军情 皇上正在大怒呢,00:22:31.100,00:22:34.040,His Majesty is outraged about it.
00:22:33.440,00:22:35.350,可是和安答应的父亲有关,00:22:34.496,00:22:36.536,Does that involve Companion An's father?
00:22:35.600,00:22:36.950,这个奴才倒不清楚,00:22:36.800,00:22:38.536,"That, I have no idea."
00:22:38.160,00:22:40.720,只知道皇上才下了旨意,,,
00:22:41.000,00:22:43.710,为首的蒋文庆啊 斩立决,00:22:39.453,00:22:45.160,"All I know is that His Majesty has announced
the head official, Jiang Wenqing to be beheaded immediately."
00:22:44.400,00:22:46.230,那 那其他人呢,,,
00:22:46.480,00:22:47.790,这个奴才就不知道了,00:22:45.300,00:22:47.680,What ... what about the other officials?
00:22:48.480,00:22:49.110,怎么,00:22:47.700,00:22:49.600,"I don't know, My Lady."
00:22:49.880,00:22:50.750,贵人您是为了,,,
00:22:51.080,00:22:52.710,安答应的父亲求情来的,00:22:49.700,00:22:54.240,"So ... you came here for Companion An's father, My Lady?"
00:22:53.000,00:22:55.070,是 安答应伤心,,,
00:22:55.600,00:22:56.990,我不能坐视不管,00:22:54.300,00:22:57.920,"Yes, Companion An was overcome with grief.
I have to do something."
00:22:57.200,00:22:57.950,不不不,,,
00:22:58.200,00:22:59.750,依奴才看 贵人哪,00:22:58.220,00:22:59.380,No no no ...
00:23:00.000,00:23:02.590,您这个事最好是袖手旁观,00:22:59.380,00:23:03.920,"In my view, My Lady, all you can do is stand by."
00:23:03.880,00:23:05.020,还请公公赐教,00:23:04.814,00:23:06.600,"I hope you will enlighten me, sir."
00:23:08.160,00:23:11.230,皇上一向不喜欢后宫过问政事的,00:23:09.306,00:23:12.320,"His Majesty strongly disapproves of
any concubine interfering in state affairs."
00:23:11.520,00:23:13.230,尤其这是军情大事,,,
00:23:13.800,00:23:16.260,事关年羹尧西北的军情大事,00:23:12.500,00:23:17.500,"This is a great concern for the military,
especially for General Nian Gengyao."
00:23:16.520,00:23:17.500,您这一开口,,,
00:23:17.760,00:23:20.060,不等于是跟华妃过不去了吗,00:23:17.600,00:23:21.160,"If you speak for Companion An,
isn't that equivalent to offending Consort Fleur?"
00:23:20.320,00:23:22.110,可是这不是过得去过不去的事,00:23:21.160,00:23:23.540,But this is not about offending anyone.
00:23:22.720,00:23:23.830,能救人的时候,,,
00:23:24.440,00:23:26.110,我也不能眼睁睁地看着,00:23:23.766,00:23:27.380,"I cannot just stand and watch
when I can save someone's life."
00:23:26.640,00:23:28.310,这事您只能看着,00:23:27.664,00:23:29.920,I'm afraid that is what you will have to do.
00:23:29.040,00:23:29.710,您想,,,
00:23:29.960,00:23:32.390,这事不管皇上知道是不知道,00:23:30.000,00:23:33.780,Please consider:  your father will be lenient as soon as he receives a letter from you;
00:23:32.680,00:23:34.070,您这一封家书回去,,,
00:23:34.640,00:23:36.940,沈大人自然是会从轻发落,00:23:33.780,00:23:38.080,it makes no difference if His Majesty knows of your involvement or not.
00:23:37.560,00:23:40.020,可万一被人抓了这事小题大做,,,
00:23:40.560,00:23:42.070,皇上龙颜震怒,00:23:38.860,00:23:43.340,"But if someone uses your action
 in order to provoke anger in His Majesty,"
00:23:42.520,00:23:45.870,那您父亲的前程要是不要啊,00:23:43.840,00:23:47.540,wouldn't that imperil your father's post?
00:23:50.080,00:23:52.190,可是安答应的父亲,,,
00:23:52.480,00:23:53.950,要真的是被冤枉的话,00:23:51.300,00:23:54.980,But what if Companion An's father is not guilty...?
00:23:54.280,00:23:55.310,要真是冤枉的,,,
00:23:55.600,00:23:58.060,自然会给他洗雪冤枉,00:23:55.000,00:23:59.360,"If so, he will be proven innocent after investigation."
00:23:58.520,00:23:59.660,您没看见皇上,,,
00:23:59.920,00:24:02.070,方才为这事发多大的脾气呢,00:23:59.500,00:24:03.380,You didn't see how furious His Majesty was just now.
00:24:02.520,00:24:05.470,您犯不着拿着您的荣宠去犯险哪,00:24:03.719,00:24:07.119,It's not worthwhile to risk His Majesty's favor for this matter.
00:24:06.600,00:24:09.350,再说 您现下正怀着龙裔,,,
00:24:09.600,00:24:11.470,眼看着就要协理六宫了,00:24:07.774,00:24:12.594,"Also, you are now with child and in sight of
the power to assist in palace management,"
00:24:11.760,00:24:14.220,犯不着去蹚这摊浑水呀,00:24:12.820,00:24:15.780,why would you wade into this muddy water?
00:24:14.840,00:24:17.300,再说 您这一开口劝,,,
00:24:17.720,00:24:19.510,华妃娘娘那儿知道了,00:24:15.900,00:24:20.500,"And if Her Highness Consort Fleur
hears about your pleading,"
00:24:20.040,00:24:23.070,安答应的父亲非死不可了,00:24:21.217,00:24:24.536,Companion An's father will definitely die.
00:24:26.320,00:24:27.150,那,00:24:27.500,00:24:28.563,Then ...
00:24:34.240,00:24:36.590,请公公不要和皇上说我来过了,,,
00:24:36.840,00:24:37.710,是,00:24:35.000,00:24:38.600,"- Sir, please don't tell His Majesty that I came.
- Yes."
00:24:38.080,00:24:40.350,外头热 小主 您赶快回去吧,00:24:38.700,00:24:41.720,"It is hot out here.
Please go quickly, My Lady."
00:24:50.200,00:24:51.230,你先别伤心,,,
00:24:52.320,00:24:53.540,咱们想想别的法子,00:24:51.339,00:24:55.379,Don't be sad. We'll think of another way.
00:24:55.280,00:24:56.470,还有什么法子,,,
00:24:57.800,00:24:59.310,眉姐姐都不能救,00:24:56.200,00:24:58.220,What other way?
00:25:00.360,00:25:02.230,旁人就更没办法了,00:24:58.980,00:25:00.960,Even Meizhuang wasn't able to do anything about it.
00:25:02.760,00:25:03.870,眉姐姐的话在理,00:25:01.500,00:25:03.580,No one else would be able to.
00:25:04.760,00:25:05.820,她若一开口,00:25:03.882,00:25:05.882,What Meizhuang said is reasonable.
00:25:06.360,00:25:08.920,这华妃就更要置你父亲于死地了,00:25:06.000,00:25:10.220,"If she speaks up for you, Consort Fleur
will spare no effort to put your father to death."
00:25:10.520,00:25:12.150,那我还能怎么办,00:25:11.546,00:25:13.646,But what else can I do?
00:25:12.720,00:25:18.390,皇上今天已经下令蒋文庆斩立决,00:25:13.956,00:25:19.636,"His Majesty has announced the
immediate execution of Jiang Wenqing today."
00:25:20.320,00:25:24.190,明日可能就是我父亲了,00:25:21.439,00:25:22.901,Tomorrow ...
,,,00:25:23.343,00:25:26.022,it could be my father.
00:25:27.920,00:25:29.270,咱们去求求皇后吧,00:25:29.295,00:25:31.071,Let's go see the Empress.
00:25:31.400,00:25:32.150,皇后,00:25:32.602,00:25:33.602,The Empress ...
00:25:38.560,00:25:39.950,给两位小主请安,,,
00:25:40.720,00:25:41.830,烦请通报皇后,00:25:39.700,00:25:41.400,Peace to My Ladies.
00:25:42.080,00:25:43.750,我与安小主想面见皇后,00:25:41.900,00:25:45.080,"May I trouble you to inform Her Majesty
that Companion An and I request an audience?"
00:25:44.120,00:25:45.630,两位小主来得真是不巧,,,
00:25:46.080,00:25:47.060,娘娘出去了,00:25:45.200,00:25:46.880,"You've come at an inopportune time, My Ladies."
00:25:47.480,00:25:48.310,我记得这个时候,00:25:47.000,00:25:48.360,Her Majesty is not here.
00:25:48.680,00:25:50.190,娘娘应该午睡才起啊,00:25:48.626,00:25:51.566,"If I recall correctly, this is the time Her Majesty rises from her afternoon nap."
00:25:50.720,00:25:53.150,娘娘去勤政殿见皇上了,00:25:51.840,00:25:54.400,"Her Majesty went to see His Majesty
 at the Governance Hall."
00:25:53.840,00:25:55.390,两位小主暑天赶来,,,
