00:40:12.240,00:40:13.070,活着又有什么用啊,00:40:11.620,00:40:12.880,It's dead.
,,,00:40:12.960,00:40:14.580,"Even if it was alive,"
00:40:13.800,00:40:16.360,这么丑一只灰蝴蝶 能成什么事,00:40:14.580,00:40:17.600,"such an ugly butterfly, what use would it be?"
00:40:17.960,00:40:19.310,小主吩咐这么点事都办不好,00:40:18.780,00:40:20.460,I can't even do what My Lady asked me to.
00:40:19.760,00:40:20.390,真没用,00:40:20.460,00:40:21.240,I'm useless.
00:40:20.680,00:40:22.270,这时节我们上哪儿去找蝴蝶呀,00:40:21.480,00:40:23.360,Where can we find butterflies this time of the year?
00:40:22.800,00:40:23.830,我倒知道有一地儿有,,,
00:40:24.320,00:40:24.870,哪里,00:40:23.680,00:40:24.840,I know a place.
00:40:25.280,00:40:26.190,昌平行宫有温泉,00:40:25.300,00:40:26.100,Where is that?
00:40:26.520,00:40:28.270,那儿地气暖和 花还开得多,00:40:26.220,00:40:27.340,Changping Palace has hot springs.
00:40:28.640,00:40:29.390,自然就有蝴蝶吧,00:40:27.340,00:40:29.480,It’s warmer and there will still be flowers there.
00:40:30.960,00:40:32.150,可是咱没法出去啊,00:40:29.480,00:40:30.840,I believe there will also be butterflies.
,,,00:40:31.780,00:40:33.520,But we can’t get out of the palace.
00:40:33.080,00:40:35.190,再说这阵儿也没人上昌平啊,00:40:33.960,00:40:36.260,"Besides, no one plans to go to Changping at the moment."
00:40:38.400,00:40:39.270,你先四处找找,00:40:39.180,00:40:40.440,Keep looking around.
00:40:39.680,00:40:41.710,你们四处看一下 我去去就来,00:40:40.440,00:40:42.820,"Keep looking, everyone! I'll be back shortly."
00:41:04.520,00:41:06.430,浣碧姑娘每次都这样悄悄地来,,,
00:41:06.760,00:41:07.470,要吓人一大跳,00:41:05.360,00:41:08.440,"Jade, you always come in so quietly and startle us."
00:41:08.440,00:41:09.870,王爷 若是阿晋,,,
00:41:10.240,00:41:10.990,以后再这么说的话,00:41:09.280,00:41:12.280,"Your Lordship, if Ajin keeps saying that,"
00:41:11.480,00:41:13.270,那奴婢以后就真的不敢再来了,00:41:12.320,00:41:14.100,I will not dare to visit you anymore.
00:41:13.440,00:41:14.070,去,00:41:14.240,00:41:15.160,Stop it.
00:41:15.960,00:41:17.100,可是碎玉轩有事,,,
00:41:17.760,00:41:18.470,罢了 罢了,00:41:16.780,00:41:18.560,Does the Palace of Pearl Jade have a request for me?
00:41:18.760,00:41:19.950,浣碧姑娘还是别开口了,00:41:18.640,00:41:19.580,"Please, Jade."
,,,00:41:19.580,00:41:21.200,You’d better not say it.
00:41:20.440,00:41:22.470,上回来眼泪汪汪地求咱们王爷,00:41:21.280,00:41:23.160,"Last time, you came tearfully"
00:41:22.880,00:41:23.750,开解莞嫔娘娘,00:41:23.160,00:41:24.900,to ask His Lordship to console Concubine Sourire.
00:41:24.080,00:41:25.870,这回来不知道又是什么差事,00:41:24.900,00:41:27.000,I wonder what task it is this time.
00:41:28.760,00:41:29.510,别瞎说,00:41:29.660,00:41:30.720,That's enough.
00:41:30.920,00:41:32.110,有什么事尽管说,00:41:31.700,00:41:33.380,Please don't hesitate to ask.
00:41:33.400,00:41:36.310,王爷 我家小主不知是怎么了,00:41:34.200,00:41:37.320,"Your Lordship, I don’t understand why,"
00:41:37.080,00:41:38.190,让人去捉蝴蝶,00:41:37.920,00:41:39.600,but My Lady asked us to capture butterflies.
00:41:38.880,00:41:41.230,这个时节哪儿还有什么蝴蝶呀,00:41:39.760,00:41:42.300,How is that possible this time of the year?
00:41:42.080,00:41:42.830,奴婢是怕,,,
00:41:43.760,00:41:45.710,上次王爷没有把小主劝好,00:41:42.880,00:41:46.820,I’m afraid Your Lordship didn’t do well comforting her
00:41:46.080,00:41:47.140,真是伤心坏了呢,00:41:46.820,00:41:48.540,and she became confused in her sadness.
00:41:48.840,00:41:51.400,除了蝴蝶她还要别的什么,00:41:49.600,00:41:52.700,"Other than butterflies, what does she want?"
00:41:53.160,00:41:54.350,倒也没别的什么了,00:41:53.980,00:41:55.520,Nothing else.
00:41:58.200,00:42:00.660,如果蝴蝶真的能让莞嫔,,,
00:42:01.040,00:42:01.990,舒散心结的话,00:41:59.060,00:42:03.300,"If butterflies can help her overcome her grief,"
00:42:02.600,00:42:04.350,那本王为她尽力寻找就是了,00:42:03.420,00:42:05.480,I will do my best to find them.
00:42:05.040,00:42:07.910,至于旁的 你要多陪陪她,00:42:05.780,00:42:08.980,"Other than that, you should spend more time with her."
00:42:08.720,00:42:09.910,这时候都快入冬了,00:42:09.480,00:42:11.220,It’s almost winter now.
00:42:10.640,00:42:11.860,哪里还有蝴蝶呀,00:42:11.460,00:42:12.980,Where can we find butterflies?
00:42:12.160,00:42:14.460,听说昌平行宫有温泉 那儿暖和,00:42:13.020,00:42:15.500,I heard there are hot springs at the Changping Palace.
00:42:15.520,00:42:16.430,或许会有,,,
00:42:16.960,00:42:17.870,那我就去趟昌平,00:42:16.520,00:42:17.660,Maybe there are butterflies there.
00:42:18.400,00:42:19.150,也不是什么难事,00:42:17.820,00:42:19.120,"Then I will go to Changping,"
,,,00:42:19.120,00:42:20.580,It’s not very difficult.
00:42:23.000,00:42:36.000,"[contact translators] carsenwei@yahoo.com
[subtitles subscription] liberapay.com/ZHZSubbers",00:42:22.800,00:42:36.000,"Translators: The Magpie Bridge Brigade 鹊桥小队翻译组
Subscription: magpiebridgebrigade.cn
Twitter/FB/IG @BrigadeMagpie 公众号/微博: 鹊桥小队翻译组"
00:42:36.000,00:42:39.000,"Theme: The Lonely Phoenix
[phoenix is the symbol of an empress]",00:42:36.000,00:42:39.000,"Theme: The Lonely Phoenix
[phoenix is the symbol of an empress]"
00:42:41.000,00:42:59.000,"I dimly recall the colorful blooms in every summer.
They are as distant as the autumn moon in the water.",00:42:41.000,00:42:59.000,"I dimly recall the colorful blooms in every summer.
They are as distant as the autumn moon in the water."
00:42:59.000,00:43:19.000,"He loved me with a volatile heart.
And before I knew it, we fell apart.",00:42:59.000,00:43:19.000,"He loved me with a volatile heart.
And before I knew it, we fell apart."
00:43:19.000,00:43:36.000,"Behind me are the promises and longing.
Before me lie the flute and the zither.",00:43:19.000,00:43:36.000,"Behind me are the promises and longing.
Before me lie the flute and the zither."
00:43:36.000,00:43:54.000,"I loved you with my body and soul
But you hurt me from head to toe.",00:43:36.000,00:43:54.000,"I loved you with my body and soul
But you hurt me from head to toe."
00:43:54.000,00:44:02.000,"My wish ran athwart
and I ended up a fool of my destiny.",00:43:54.000,00:44:02.000,"My wish ran athwart
and I ended up a fool of my destiny."
00:44:02.000,00:44:14.000,My love was the wind-swept flowers from a tree.,00:44:02.000,00:44:14.000,My love was the wind-swept flowers from a tree.
00:44:14.000,00:44:33.000,"A plum bloomed in winter hoping for a fruitful summer.
But the irresistible winds of destiny destroyed her wish.",00:44:14.000,00:44:33.000,"A plum bloomed in winter hoping for a fruitful summer.
But the irresistible winds of destiny destroyed her wish."
00:44:33.000,00:44:41.000,"You can hear the flapping of a phoenix
but you will never see it.",00:44:33.000,00:44:41.000,"You can hear the flapping of a phoenix
but you will never see it."
00:44:41.000,00:44:47.600,What you see is the falling leaves from the phoenix tree.,00:44:41.000,00:44:47.600,What you see is the falling leaves from the phoenix tree.
00:44:51.000,00:45:04.000,The falling leaves from the phoenix tree.,00:44:51.000,00:45:03.500,The falling leaves from the phoenix tree.
